id,dataset,question,ground_truth_answer,nvidia_model,nvidia_parsed_answer,nvidia_raw_response,nvidia_outcome
Text-34,medxpertqa,"A 65-year-old woman presents with mild shortness of breath and a chronic, nonproductive cough. She reports being in good health, has never smoked, and has completed all age-appropriate cancer screenings.  

Her vital signs are normal, and her oxygen saturation is 95% on room air. A chest X-ray reveals a moderate left pleural effusion without any additional abnormalities.  

Thoracentesis yields a thin, light-green fluid with the following analysis:  

| Parameter | Result |  
| --- | --- |  
| pH | 7.00 |  
| Lactate dehydrogenase | 2998 U/L |  
| Total protein | 3.7 g/dL |  
| Total glucose | <20 mg/dL |  
| Leukocyte count | 356/mm³ |  
| Erythrocyte count | 433/mm³ |  

Gram stain and acid-fast bacilli smear are negative for organisms, but cytology reveals slender, elongated, spindle-shaped cells.  

Which additional physical examination finding is most likely in this patient?
Answer Choices: (A) Sclerodactyly with skin tightening (B) Joint hypermobility with skin hyperextensibility (C) Gottron's papules over the knuckles (D) Raynaud's phenomenon with digital ulcers (E) Scattered, seborrheic keratoses over the chest and back (F) Clubbing of the digits (G) Synovitis of the metacarpophalangeal joints and subcutaneous nodules (H) Erythema nodosum on the shins (I) Morning stiffness in the proximal interphalangeal joints (J) Butterfly rash across the nasal bridge",G,deepseek-ai/deepseek-r1,G,"<think>
Okay, let's tackle this question. So, the patient is a 65-year-old woman with shortness of breath and a chronic nonproductive cough. She's never smoked and has done all cancer screenings. The chest X-ray shows a left pleural effusion. The thoracentesis results are key here.

Looking at the fluid analysis: pH is 7.00, which is low. LDH is really high at 2998 U/L. Total protein is 3.7 g/dL. Glucose is very low, less than 20. The leukocyte count is 356, which isn't super high. Cytology shows spindle-shaped cells. Gram stain and AFB are negative, so probably not infection. Cytology with spindle cells—maybe mesothelial cells? Or could it be something else like malignancy?

Wait, the Light's criteria for exudative vs transudative effusion. Exudative meets if any of these: pleural fluid protein/serum protein >0.5, LDH >2/3 upper limit of serum, or pleural LDH >200. Here, the LDH is way high, so exudative. But what's causing it?

The low pH (acidic) and low glucose in pleural fluid. Those are classic for certain conditions. Empyema can have low pH and glucose, but the gram stain is negative. Rheumatoid arthritis effusions also have low glucose and pH. Malignancy can sometimes have low pH and glucose too. But the cytology shows spindle-shaped cells. Wait, mesothelioma? But she's never smoked. Or maybe another cancer. But the question says cancer screenings are done, so maybe not primary lung cancer. But maybe metastatic?

Wait, the spindle-shaped cells. Mesothelioma is a possibility. But other possibilities? Tuberculosis can cause effusions, but AFB is negative. Also, the cells here are spindle-shaped. Alternatively, could this be a rheumatoid effusion? Let's think about the answer choices.

The options are various physical exam findings. Let's list them again:

A. Sclerodactyly with skin tightening – that's systemic sclerosis (scleroderma)
B. Joint hypermobility with skin hyperextensibility – Ehlers-Danlos syndrome
C. Gottron's papules – dermatomyositis
D. Raynaud's with digital ulcers – again, maybe scleroderma or other connective tissue disease
E. Seborrheic keratoses – benign skin growths, not related
F. Clubbing – maybe lung cancer, but she's screened and non-smoker
G. Synovitis and nodules – rheumatoid arthritis
H. Erythema nodosum – sarcoidosis, infections, etc.
I. Morning stiffness in PIP joints – rheumatoid or other arthritis
J. Butterfly rash – SLE

So, the pleural fluid analysis. Exudative, low pH, low glucose. High LDH. Negative for infection. Spindle cells. Let's think about possible causes. 

Rheumatoid arthritis (RA) can cause pleural effusions. RA effusions are exudative, low glucose, low pH. The cytology in RA might show chronic inflammatory cells, but spindle-shaped cells? Not sure. Alternatively, if it's a rheumatoid nodule or something. But RA patients often have joint findings. So answer G is synovitis and subcutaneous nodules. If the patient has RA, then G would be a possible finding. But does the presence of spindle cells in the fluid point to something else?

Another possibility is malignant effusion. Spindle-shaped cells could be malignant cells, like mesothelioma. But she's non-smoker. However, mesothelioma is linked to asbestos exposure, not smoking. But the question doesn't mention that. If it's mesothelioma, then what physical signs? Clubbing maybe? But answer F is clubbing. But the options don't have that as a direct link. Alternatively, maybe another malignancy.

Wait, the spindle-shaped cells. If they are mesothelial cells, maybe reactive. But in some conditions, like rheumatoid pleuritis, the cells can be spindle-shaped. Alternatively, in tuberculosis, but AFB is negative here.

Alternatively, systemic lupus erythematosus (SLE) can cause pleural effusions, but the fluid in SLE is usually exudative, with normal glucose and pH. So not matching here.

The low glucose and pH are more in line with RA, empyema, or malignancy. Since infection is ruled out (negative stains), RA or malignancy are possibilities.

If RA is the cause, then physical exam findings would include synovitis (swollen, tender joints), subcutaneous nodules (rheumatoid nodules). So answer G. But the patient's presentation is mainly pleural effusion. If she has RA, she might have joint symptoms. The question asks which additional physical exam finding is most likely. So if the answer is G, then that's possible.

Alternatively, if the spindle cells are from a malignancy like mesothelioma, then maybe clubbing (F) or other signs. But mesothelioma is rare and linked to asbestos. The patient's age and presentation could fit, but without exposure history, maybe not. Also, the cytology here says spindle-shaped cells. Mesothelioma cells can be spindle-shaped. But if that's the case, then the effusion would be malignant. But the question states that she's completed cancer screenings. However, mesothelioma isn't typically detected by standard cancer screenings. So maybe that's possible.

But the answer options don't include findings specific to mesothelioma. So perhaps the correct answer is related to RA. Let's think again.

In RA, the pleural fluid can have low glucose, low pH, high LDH. The presence of spindle-shaped cells could be mesothelial cells, but maybe in RA, there's a chronic inflammatory process leading to such cells. If the patient has RA, then she might have joint findings. Answer G is synovitis of MCP joints and subcutaneous nodules. Answer I is morning stiffness in PIP joints. Morning stiffness is common in RA, but synovitis and nodules are more specific. So G would be more indicative of RA.

Alternatively, answer I (morning stiffness) is a symptom, not a physical exam finding. The question asks for physical exam findings. So G would be a physical finding.

So if the patient has RA, then answer G is the correct choice. But does the presence of spindle-shaped cells in the fluid support RA? Not sure. Alternatively, maybe another connective tissue disease.

Wait, the spindle-shaped cells could be from a malignancy. If it's a malignant effusion, then maybe the primary is elsewhere. But she's had cancer screenings. However, maybe a cancer not covered by standard screenings. For example, mesothelioma, which isn't typically screened for. But again, physical findings for mesothelioma? Clubbing (F) is possible, but not specific. Or maybe no specific findings. But the answer options don't include that.

Alternatively, let's look at the answer options again. Let's think about each option:

A. Sclerodactyly and skin tightening: systemic sclerosis. These patients can have pleural effusions, but the fluid analysis here (low glucose, pH) is more RA or infection. Scleroderma may have effusions but more commonly pulmonary fibrosis. Also, the presence of spindle cells? Not sure.

B. Ehlers-Danlos: hypermobility. Not related to pleural effusion.

C. Gottron's papules: dermatomyositis. Could have interstitial lung disease, but effusions are less common. Also, Gottron's are on the knuckles.

D. Raynaud's with ulcers: seen in scleroderma or other CTDs. Again, not directly linked to the effusion findings here.

E. Seborrheic keratoses: benign, age-related. Not relevant.

F. Clubbing: could be lung cancer, but she's non-smoker and screened. Or other causes like mesothelioma, but no info on exposure.

G. Synovitis and nodules: RA. This would fit with the effusion's characteristics.

H. Erythema nodosum: associated with sarcoid, infections, etc. Not matching the fluid.

I. Morning stiffness: symptom, not a physical finding. The question asks for physical exam findings.

J. Butterfly rash: SLE. But SLE effusions usually have higher pH and glucose.

So, putting it all together, the most likely answer is G: synovitis of the MCP joints and subcutaneous nodules, indicating RA. The pleural effusion's characteristics (low pH, low glucose, high LDH) align with RA. The spindle-shaped cells might be part of the chronic inflammatory process. So the physical exam finding would be G.
</think>

Answer: G",Correct
Text-35,medxpertqa,"A 1550-g (3.3-lb) male newborn is born to a 26-year-old woman, gravida 2, para 2, at 33 weeks' gestation. Apgar scores are 7 and 8 at 1 and 5 minutes, respectively. The pregnancy was complicated by iron deficiency anemia. The mother has no significant medical history and has received all routine immunizations. She has smoked half a pack of cigarettes daily for 10 years, does not consume alcohol, and has no history of illicit drug use. Her first pregnancy and delivery were complicated by placenta previa. What is the most appropriate immunization recommendation for this newborn?
Answer Choices: (A) Rotavirus vaccine at 2 months of chronological age (B) Pneumococcal conjugate vaccine (PCV13) at 2 months of chronological age (C) Influenza vaccine at 6 weeks of chronological age (D) Polio vaccine at birth (E) Hepatitis A vaccine at 6 months of chronological age (F) Hepatitis B vaccine now (G) Bacille Calmette-Guérin (BCG) vaccine at birth (H) Varicella vaccine at 2 months of chronological age (I) Measles, mumps, rubella vaccine at 2 months of chronological age (J) Diphtheria and tetanus toxoids, acellular pertussis (DTaP) vaccine at 2 months of chronological age",J,deepseek-ai/deepseek-r1,N/A,NVIDIA Call Exception: Request timed out.,API Error
Text-36,medxpertqa,"A full-term male infant is born to a 32-year-old woman after a precipitous vaginal delivery that occurred just as the mother arrived in the emergency department. The mother had complete prenatal care without complications, but at the time of delivery, her hepatitis B virus status was unknown. Hepatitis B serology results are pending.


Which one of the following actions should be done in the immediate postnatal period to protect this infant from hepatitis B virus infection?
Answer Choices: (A) Give first dose of hepatitis B vaccine at discharge (B) Administer both hepatitis B vaccine and hepatitis B immune globulin within 12 hours of birth (C) Wait for maternal serology results before initiating any prophylaxis (D) Administer hepatitis B vaccine only within 12 hours of birth (E) Administer hepatitis B vaccine within 24 hours and HBIG if mother tests positive (F) Delay vaccination until 2 months of age when other routine vaccines begin (G) Test infant for HBV infection before initiating prophylaxis (H) Administer hepatitis B immune globulin only within 12 hours of birth (I) Start antiviral therapy and monitor liver function tests (J) Administer HBIG only and wait for maternal serology results",D,deepseek-ai/deepseek-r1,D,"<think>
Okay, so the question is about a newborn whose mother's hepatitis B status is unknown at the time of delivery. The mother had complete prenatal care but the results are pending. The question is asking what immediate action should be taken to protect the infant from hepatitis B.

First, I need to recall the standard protocols for managing infants born to mothers with unknown hepatitis B status. From what I remember, the CDC guidelines say that if the mother's HBsAg status is unknown at delivery, the infant should receive the hepatitis B vaccine within 12 hours of birth. Additionally, the mother's blood should be tested as soon as possible. If she tests positive, then the infant should also get HBIG (hepatitis B immune globulin) as soon as possible, preferably within 12 hours. But if the mother's status is unknown, do you give both right away or wait?

Wait, the options here are B (both vaccine and HBIG within 12 hours), D (vaccine only within 12 hours), E (vaccine within 24 hours and HBIG if mother is positive), etc. The current guidelines, I think, state that if the mother's status is unknown, the infant should get the vaccine within 12 hours. But if the mother is found to be positive, then HBIG should be given as soon as possible, but no later than 7 days. So in this case, since the mother's results are pending, the immediate action is to give the vaccine. But do you also give HBIG right away, or wait for the results?

Wait, maybe the answer is B. Because if the mother's status is unknown, the protocol might be to administer both the vaccine and HBIG. Wait, no. Let me check. The standard approach for infants born to HBsAg-positive mothers is both vaccine and HBIG within 12 hours. If the mother's status is unknown, the vaccine is given within 12 hours, and the mother is tested. If she is positive, then HBIG is given as soon as possible. But if the mother's status is unknown and you can't get the results quickly, then you might give both. Wait, but the CDC says that for infants born to mothers with unknown HBsAg status, administer the HepB vaccine within 12 hours. And the mother should be tested immediately. If she is found to be HBsAg-positive, the infant should receive HBIG as soon as possible but no later than age 7 days. If the mother’s test results are unavailable by the time of discharge, then the infant should receive HBIG as well. Wait, that's a bit conflicting. Let me think again.

The CDC's 2018 guidelines state: For infants born to mothers with unknown HBsAg status, administer the HepB vaccine within 12 hours of birth, regardless of birth weight. For infants weighing ≥2000 grams, if maternal HBsAg status remains unknown after initial vaccine, administer HBIG by age 7 days. For infants <2000 grams, administer HBIG along with the vaccine within 12 hours. Wait, so birth weight matters here. The question says the infant is full-term, so likely ≥2000 grams. So in that case, if the mother's status is unknown, the infant gets the vaccine within 12 hours. Then, if the mother is found positive, HBIG is given asap. If the mother's status remains unknown, then HBIG is given by 7 days. But in the scenario here, the mother's serology is pending. So the immediate action is to give the vaccine. But if the mother's results come back positive, then HBIG is given. But the options here are about what to do in the immediate postnatal period. So the answer would be D (vaccine only within 12 hours) and then if the mother is positive, HBIG is given. But option E says vaccine within 24 hours and HBIG if mother tests positive. Wait, but the vaccine should be given within 12 hours, not 24. So option D is vaccine within 12 hours. Option B is both within 12 hours. But according to the guidelines, if the mother's status is unknown, and the infant is ≥2000 grams, you give the vaccine within 12 hours. If the mother is found positive, then HBIG is given. If the mother's status remains unknown, then HBIG is given by 7 days. So in the immediate postnatal period, the correct action is to give the vaccine. So the answer would be D. But wait, the options: E says vaccine within 24 hours and HBIG if mother tests positive. But the correct timing is 12 hours. So D is the answer. But wait, the question says the mother's serology is pending. So if the results come back positive, then HBIG is given. But the question is about what to do immediately. So the answer is D. But wait, some sources say that if the mother's status is unknown, and the infant is full-term, you give the vaccine within 12 hours. If the mother is found to be positive, then HBIG is given asap. If the mother's status is still unknown, then HBIG is given within 7 days. So in the immediate period, the answer is D. But option B says both. So why would that be? Maybe if the mother is high risk, but the question says she had complete prenatal care without complications. So maybe the answer is D. But I'm a bit confused. Let me check another source. The Red Book 2021: For infants born to HBsAg-positive mothers, give HepB vaccine and HBIG within 12 hours. For mothers with unknown HBsAg status, give HepB vaccine within 12 hours. Determine mother's HBsAg status as soon as possible. If mother is HBsAg-positive, administer HBIG to infant as soon as possible (no later than 7 days). If mother's status remains unknown, some factors (like infant's weight) determine if HBIG is given. For term infants, if mother's status is unknown, give vaccine within 12 hours. If the mother is found to be positive, then HBIG is given. If the mother's status is still unknown, HBIG is not needed if the infant is term and the mother's status is unknown but the infant received the vaccine. Wait, no. The Red Book says: For infants born to mothers with unknown HBsAg status, administer HepB vaccine within 12 hours. If the mother is determined to be HBsAg-positive, the infant should receive HBIG as soon as possible but no later than 7 days. If the mother’s HBsAg status remains unknown, the infant should receive HBIG as soon as possible but no later than 7 days of age. Wait, that's conflicting. So if the mother's status is unknown, the infant gets the vaccine, and if the mother's status is still unknown, then HBIG is given. So in that case, the answer would be B (both) if the mother's status is unknown. But wait, no. The Red Book says: For infants ≥2000g, if the mother’s HBsAg status is unknown, administer HepB vaccine within 12 hours. If the mother is found to be HBsAg-positive, give HBIG. If the mother’s status remains unknown, give HBIG by 7 days. So in the immediate postnatal period, the first step is to give the vaccine. Then, if the mother's results come back positive, HBIG is given. If the results are still pending, then HBIG is given by 7 days. So in the immediate period (within 12 hours), the answer is D (vaccine only). But the options include E (vaccine within 24 hours and HBIG if mother tests positive). But the correct timing is 12 hours. So the answer would be D. However, some sources might say that if the mother's status is unknown, you give both. But according to the CDC, for infants ≥2000g, you give the vaccine within 12 hours. If the mother is positive, then HBIG is given. If the mother's status is unknown, then HBIG is given by 7 days. So in the immediate period, the answer is D. So the correct answer is D. But wait, the options: B is both within 12 hours. So why would that be? Maybe if the mother is high risk, but the question states that the mother had complete prenatal care without complications. So maybe the answer is D. But I'm a bit confused. Let me think again. The key here is that the mother's status is unknown. The correct action is to give the vaccine within 12 hours. HBIG is given only if the mother is found to be positive. If the mother's status remains unknown, then HBIG is given by 7 days. But in the immediate postnatal period, the first step is vaccine. So the answer is D. But option E says vaccine within 24 hours and HBIG if mother tests positive. But the correct timing is 12 hours. So D is the answer. Therefore, the correct answer is D.
</think>

Answer: D",Correct
