id,dataset,question,ground_truth_answer,nvidia_model,nvidia_parsed_answer,nvidia_raw_response,nvidia_outcome
Text-70,medxpertqa,"A 20-year-old male presents with a 2-week history of lower back pain that began the day after assisting his grandmother with moving. He denies any direct injury but reports intermittent radiating pain and tingling from his left lateral thigh to the medial leg and foot, which is aggravated by certain positions. On examination, the lumbar paravertebral muscles are hypertonic and tender. A straight leg test is positive on the left. Patellar reflexes are diminished (1+) on the left compared to the right (2+). Lumbar flexion elicits back pain, radiating pain, and burning sensations. The vertebral transverse processes from L1–L5 are posterior and tender on the right. The most likely location of the damaged structure is:
Answer Choices: (A) At the sacroiliac joint (B) Between T12 and L1 (C) Between L3 and L5 (D) Between L4 and L5 (E) Between L1 and L2 (F) At the coccygeal plexus (G) Between L5 and S1 (H) Within the piriformis muscle (I) Between L2 and L3 (J) Between L3 and L4",J,deepseek-ai/deepseek-r1,J,"<think>
Okay, let's tackle this question. So, the patient is a 20-year-old male with lower back pain that started after moving stuff. No direct injury, but he has radiating pain and tingling from the left lateral thigh down to the medial leg and foot. The pain gets worse with certain positions.

On exam, the paravertebral muscles are tight and tender. Straight leg test is positive on the left. Patellar reflexes are diminished on the left (1+ vs 2+ right). Lumbar flexion causes back pain and radiating burning. The transverse processes from L1-L5 are posterior and tender on the right.

Hmm. Let's break this down. The key points here are the symptoms and signs pointing to a nerve root issue. The straight leg raise test being positive suggests a lower lumbar nerve root irritation, maybe L5 or S1. But wait, the patellar reflex is involved here. The patellar reflex is primarily L3-L4. But in this case, the left patellar reflex is diminished. Wait, but the answer options include L4-L5, L5-S1, etc.

Wait, the patient's pain radiates from lateral thigh to medial leg and foot. Let me think about dermatomes. The lateral thigh is L2-L3, but moving down to medial leg and foot. The medial leg and foot—maybe L4 or L5? Let me recall: L4 covers the medial lower leg, L5 the dorsum of the foot and big toe, S1 the lateral foot. So medial leg and foot would be L4? But the tingling goes to medial foot. Hmm.

Alternatively, the sciatic nerve is involved. The straight leg test is positive, which is usually for L5/S1. But the patellar reflex is L3-L4. Wait, but the patellar reflex is diminished on the left. If there's a problem at L3-L4, that could affect the patellar reflex. But the pain is radiating down the leg. Let's think about which nerve roots correspond to which areas.

The patellar reflex (knee jerk) is mainly L3 and L4. If that's diminished, maybe a problem at L3-L4. But the pain is going down to the medial leg and foot. The medial leg is L4. The foot—maybe L5? Wait, but the pain path here is lateral thigh (maybe L2-L3) to medial leg (L4) and foot (L4 or L5). Hmm. Alternatively, maybe it's a herniated disc compressing a nerve root.

The vertebral transverse processes from L1-L5 are posterior and tender on the right. Posterior displacement might indicate a vertebral rotation or a facet joint issue. But how does that relate to the nerve root?

Wait, the patient's symptoms are left-sided. The transverse processes are posterior on the right. If there's a vertebral misalignment (like a subluxation) on the right, that might impinge the nerve root on the left? Because the spinal nerves exit below the corresponding vertebra. For example, L4 nerve root exits below L4 vertebra. So if there's a problem at L4-L5, that affects L5 nerve root. Wait, no. The nerve roots exit the spinal canal through the intervertebral foramina. The L4 nerve root exits between L4 and L5 vertebrae. So a herniation at L4-L5 would affect the L5 nerve root. Wait, no. Wait, the spinal nerve roots exit below their respective vertebrae. So the L4 nerve root exits between L4 and L5. So a disc herniation at L4-L5 would compress the L5 nerve root (since the disc is between L4 and L5, and the nerve root that exits there is L4, but the herniation would more likely affect the root that's traversing, which is L5). Wait, this is confusing. Let me get this straight.

In the lumbar spine, the nerve roots exit the spinal canal via the intervertebral foramen. The foramen between L4 and L5 is where the L4 nerve root exits. However, a disc herniation at L4-L5 would typically impinge on the L5 nerve root because the L5 root is descending past that disc level before exiting at L5-S1. So a herniated disc at L4-L5 would affect the L5 nerve root. Similarly, a herniation at L5-S1 would affect the S1 nerve root.

So, if the patient has symptoms in the L5 distribution, that would be L4-L5 disc. If S1, then L5-S1. The straight leg test is positive here, which is more common in S1 radiculopathy. But the patellar reflex is L3-L4. The patient's patellar reflex is diminished on the left, which suggests involvement of L3 or L4. But the pain is radiating down the leg. So maybe there's a problem at L4-L5 affecting the L5 nerve root, but how does that affect the patellar reflex? Wait, the patellar reflex is L3-L4. If the L4 nerve root is compressed, that could affect the patellar reflex. So if the problem is at L3-L4, compressing L4, that would affect the patellar reflex. But the pain is going down to the medial leg and foot. Let's see: L4 dermatome is the medial lower leg, medial foot. So if the L4 nerve root is compressed, the pain would be in the medial leg and foot. That matches the patient's symptoms. So if the L4 nerve root is affected, then the problem is at L3-L4 disc (since the L4 root exits at L4-L5, but a herniation at L3-L4 would compress the L4 root as it exits. Wait, no. Let me clarify again. The L4 nerve root exits between L4 and L5. So a herniation at L3-L4 would affect the L4 nerve root as it's exiting. Wait, no. Wait, the L4 nerve root exits at the L4-L5 foramen. So a herniation at L4-L5 would affect the L5 nerve root (since the L5 root is descending below L4-L5). Wait, this is getting confusing. Let me refer to standard dermatome and nerve root levels.

The L4 nerve root is responsible for the knee jerk reflex (patellar reflex). So if the reflex is diminished, that's L3-L4. The L4 dermatome is the medial lower leg and medial foot. So if the patient's pain is in those areas, that's L4. So if the L4 nerve root is compressed, that would explain the dermatomal pain and the diminished patellar reflex. Where is the L4 nerve root compressed? The L4 nerve root exits between L4 and L5. So a herniation at L4-L5 would affect the L5 root. Wait, no. Wait, the L4 nerve root exits at the L4-L5 foramen. So a disc herniation at L4-L5 would more likely affect the L5 root (since the L5 root is descending through that area). But if there's a lateral herniation, it could compress the exiting L4 root. Alternatively, a herniation at L3-L4 would affect the L4 root as it exits. Because the L4 root exits at L4-L5. Wait, no. Let me think again. Each spinal nerve root exits below the corresponding vertebra. So the L4 nerve root exits between L4 and L5. So a herniated disc at L3-L4 would affect the L4 nerve root as it's exiting through the L4-L5 foramen? No, that doesn't make sense. Wait, the disc between L3 and L4 is at the level of L3-L4. The nerve roots that exit at L3-L4 would be the L3 nerve root. The L4 nerve root exits at L4-L5. So a herniated disc at L3-L4 would compress the L4 nerve root as it's descending to exit at L4-L5. Wait, maybe. Because the L4 nerve root is formed by the spinal cord segment at L4, which then travels down through the spinal canal before exiting at the L4-L5 foramen. So a herniation at L3-L4 would compress the L4 nerve root as it's passing through that area. So, for example, a central herniation at L3-L4 could compress the L4 root. Alternatively, a herniation at L4-L5 would affect the L5 root. So if the patient has L4 symptoms (medial leg and foot, diminished patellar reflex), the lesion is likely at L3-L4. But the answer options include (J) Between L3 and L4. So that would be option J. But wait, the answer options are (C) Between L3 and L5, (D) L4-L5, (J) L3-L4.

Wait, the question is asking for the most likely location of the damaged structure. So if the L4 nerve root is compressed, the damaged structure (like a herniated disc) would be at L3-L4. So the answer would be J (Between L3 and L4). But let's check the other symptoms. The straight leg test is positive. The straight leg raise test is more commonly positive in L5/S1 radiculopathy. But it can be positive in higher roots if there's tension. However, the patellar reflex is L3-L4, so maybe the problem is higher. Also, the patient's pain is in the medial leg and foot, which is L4. So the combination of diminished patellar reflex and L4 dermatome symptoms points to L3-L4. So the answer would be J. But let's look at the answer options again. The options are (J) Between L3 and L4. So that's possible.

Alternatively, another possibility: the transverse processes from L1-L5 are posterior on the right. That might indicate a rotational dysfunction, like a vertebral rotation. If the right transverse processes are posterior, that could be a left rotation of the vertebra. But how does that relate to the nerve root compression? Maybe a facet joint issue or a subluxation causing foraminal stenosis. But the exact location would depend on which vertebra is affected. The question states that the transverse processes from L1-L5 are posterior on the right. That's a bit confusing. If all of them are posterior, maybe there's a general dysfunction. But perhaps the key is the tenderness on the right. If the right side is where the transverse processes are posterior, maybe there's a facet joint problem on the right, leading to left-sided symptoms due to nerve compression. But I'm not sure. Alternatively, the posterior displacement could be a sign of a rotated vertebra, leading to narrowing of the intervertebral foramen on the left, compressing the nerve root. For example, if the L4 vertebra is rotated to the right (right transverse process posterior), that could narrow the left intervertebral foramen at L4-L5, compressing the L5 nerve root. But the patient's symptoms are left-sided. So if the foramen on the left is narrowed, that would affect the left nerve root. But the L5 nerve root would be affected at L4-L5. But the patient's symptoms are L4 distribution. Hmm.

Alternatively, if the L3-L4 foramen is narrowed on the left, compressing the L4 nerve root. That would fit with the symptoms. But the transverse processes are posterior on the right. If the L3 vertebra is rotated to the right (right transverse process posterior), that could cause the left intervertebral foramen at L3-L4 to narrow, compressing the L4 nerve root. That would explain the left-sided symptoms. So the damaged structure (the intervertebral foramen or disc at L3-L4) would be between L3 and L4. So answer J.

So putting it all together: the patient has L4 nerve root compression (diminished patellar reflex, medial leg/foot pain), which would be due to a problem at L3-L4. The answer is J.
</think>

Answer: J",Correct
Text-71,medxpertqa,"A 25-year-old female seeks fertility consultation after one year of unsuccessful conception attempts with regular unprotected intercourse. She reports irregular menstrual cycles that complicate ovulation timing. Her medical history includes well-controlled type 2 diabetes mellitus treated with metformin, and she takes a prenatal vitamin. Current vital signs show: temperature 36.5°C (97.8°F), pulse 72/min, respirations 18/min, blood pressure 154/92 mmHg, and BMI 36 kg/m2. Physical examination reveals no significant findings. In-clinic urine pregnancy test is negative. Recent records indicate hemoglobin A1c of 5.8% and previous blood pressure of 142/88. Bedside pelvic ultrasound demonstrates a normal-sized uterus with mild endometrial thickening, no uterine fibroids, and antral follicle counts of 23 and 11 in the right and left ovaries, respectively. Along with nutritional counseling and weight loss support, what is the most appropriate next intervention?
Answer Choices: (A) Letrazole (B) Clomiphene citrate (C) Amlodipine (D) Lisinopril (E) Oral contraceptive pills (F) Insulin (G) Nifedipine (H) Spironolactone (I) Hydrochlorothiazide (J) Metoprolol",G,deepseek-ai/deepseek-r1,A,"<think>
Okay, let's see. The question is about a 25-year-old woman with infertility and irregular cycles. She's trying to conceive for a year. Her medical history includes type 2 diabetes controlled with metformin, and she's on prenatal vitamins. Her BMI is 36, which is in the obese range. Blood pressure is elevated at 154/92, and previous was 142/88. So she's got hypertension. The ultrasound shows antral follicle counts of 23 and 11. Wait, antral follicle count is a marker for ovarian reserve. High counts might suggest polycystic ovary syndrome (PCOS), right? Because PCOS is associated with multiple small follicles.

She has irregular cycles, which is a common symptom of PCOS. Also, obesity, type 2 diabetes, and hypertension are often seen in PCOS patients. So the diagnosis here is likely PCOS. The question is about the next intervention for fertility. The options include Letrazole (A) and Clomiphene (B), which are both ovulation induction agents. Letrozole is often first-line for PCOS because studies show better live birth rates compared to clomiphene. Clomiphene was traditionally used but has higher risk of multiple pregnancies and lower effectiveness in PCOS. 

Other options: C, D, G, I, J are antihypertensives. Her BP is high, so controlling that is important, but the question is about fertility. The answer should focus on the fertility treatment. The options for antihypertensives in pregnancy—like lisinopril (D) is contraindicated in pregnancy because it's an ACE inhibitor and can cause fetal issues. So maybe they need to switch her BP meds, but the question is about next intervention for fertility. The options given include the antihypertensives, but the main issue here is ovulation induction. 

So the answer is either A or B. Letrozole is preferred in PCOS. Also, the patient's BMI is 36. Clomiphene may be less effective in obese patients. Letrozole is more effective in such cases. So the correct answer is A. Letrazole. 

Other options: E is oral contraceptives, which wouldn't help with conception. F is insulin, but her A1c is 5.8%, which is well-controlled. Metformin is already part of her treatment. So the next step for ovulation induction would be Letrozole. So answer A.
</think>

Answer: A",Incorrect
Text-72,medxpertqa,"A 68-year-old man with a decade-long history of COPD presents with worsening chronic cough producing sputum and increasing shortness of breath. He denies any changes in the appearance of his phlegm. Currently, he is unable to climb a single flight of stairs without experiencing severe dyspnea. His beta natriuretic peptide (BNP) level is normal, and a transthoracic echocardiogram from three months ago shows no change, with an ejection fraction of 30%. Which of the following is the most appropriate treatment?
Answer Choices: (A) Start azithromycin and observe for 72 hours (B) Start furosemide and monitor daily weights (C) Start inhaled corticosteroids (D) Add tiotropium to current regimen (E) Add oral prednisone for 5 days (F) Add a long-acting beta-agonist (LABA) (G) Initiate pulmonary rehabilitation program (H) Initiate non-invasive positive pressure ventilation (I) Increase dose of Ipratropium and albuterol and observe for 72 hours (J) Start levofloxacin and observe for 72 hours",J,deepseek-ai/deepseek-r1,D,"<think>
Okay, let's tackle this question. So, the patient is a 68-year-old man with a 10-year history of COPD. His main issues now are worsening chronic cough with sputum and increased shortness of breath. The sputum hasn't changed in appearance, which might mean it's not a bacterial infection. He can't climb a flight of stairs without severe dyspnea. His BNP is normal, so heart failure is less likely. The echocardiogram from three months ago shows an ejection fraction of 30%, which is low (normal is like 55-70%), but the note says there's no change. So maybe he has heart failure with reduced ejection fraction (HFrEF), but since BNP is normal now and the echo hasn't changed, his current symptoms are probably not due to heart failure exacerbation.

The question is about the most appropriate treatment. Let's look at the options. The patient's symptoms are worsening of his COPD. Since there's no mention of increased sputum purulence or other signs of infection (like fever), antibiotics (options A, J) might not be necessary. The BNP is normal, so furosemide (B) for fluid overload in heart failure might not be needed here. 

Inhaled corticosteroids (C) are part of COPD management, but usually in combination with long-acting bronchodilators. Tiotropium (D) is a long-acting anticholinergic. If he's already on some regimen, adding tiotropium could help. Oral prednisone (E) is used for exacerbations, which this might be. But the question is about chronic management or an acute exacerbation. The symptoms are worsening, so maybe an exacerbation. But the sputum hasn't changed, so maybe not infectious. Steroids could help. 

Long-acting beta-agonist (F) could be added if not already on one. Pulmonary rehab (G) is definitely recommended for COPD patients, but maybe in stable cases. Non-invasive ventilation (H) is for acute respiratory failure. Increasing ipratropium and albuterol (I) would be short-acting bronchodilators, perhaps for acute relief. 

So, the patient's current treatment isn't specified. But in COPD management, for patients with persistent symptoms, adding long-acting bronchodilators is key. If he's already on a LABA or LAMA (like tiotropium), maybe adding another. But the options are separate. Tiotropium is a LAMA. If he's not on that, adding it could help. Alternatively, if he's on a LAMA, adding a LABA (F) might be next. 

But the question says ""add tiotropium to current regimen"" (D) or ""add LABA"" (F). If he's already on a LAMA, maybe adding LABA. But without knowing current meds, perhaps the best step is to optimize bronchodilation. Since he's having increased symptoms, maybe he's on short-acting and needs a long-acting. Tiotropium is a once-daily LAMA. Alternatively, if he's already on a LAMA, adding a LABA would be next. But the options don't say. 

Alternatively, since he's having an exacerbation (worsening symptoms), but no signs of infection. For a moderate exacerbation without infection, steroids (E) might be indicated. But the answer options include adding tiotropium (D) or starting inhaled corticosteroids (C). Wait, but inhaled corticosteroids are usually added in combination with LABAs for patients with frequent exacerbations. 

Alternatively, if he's not on a long-acting bronchodilator, adding tiotropium (D) would be appropriate. If he's already on a LAMA, then adding a LABA (F) or inhaled corticosteroid (C). But the question doesn't specify his current meds. 

The patient's ejection fraction is 30%, which is heart failure. Some COPD medications can affect the heart. For example, beta-agonists can increase heart rate, which might be a problem in heart failure. But LABAs are generally considered safe. Tiotropium (anticholinergic) doesn't have cardiac issues. So maybe adding tiotropium (D) is safer given his low EF. 

Alternatively, if he's not on any long-acting bronchodilators, starting one would be the first step. Since he's having increased symptoms, optimizing bronchodilation is key. So adding tiotropium (D) or a LABA (F). But which is better? For COPD, LAMA or LABA as monotherapy? Guidelines suggest LAMA as first-line. So if he's not on a LAMA, adding tiotropium (D) would be appropriate. 

Alternatively, if he's already on a LAMA, then adding a LABA (F) would be step-up. But the question doesn't say. So assuming he's not on a LAMA, adding tiotropium (D) would be the best choice. 

Another option is pulmonary rehab (G), which is a cornerstone of management. But the question is about treatment. Pulmonary rehab is a non-pharmacological intervention. But in the context of worsening symptoms, maybe optimizing meds first. 

Oral prednisone (E) for 5 days is for exacerbations. If this is an acute exacerbation, then steroids would be indicated. But the patient's symptoms are chronic worsening. The question says ""worsening chronic cough"" and ""increasing shortness of breath"". So maybe it's an exacerbation. But the absence of sputum color change and normal BNP (so not heart failure) suggests COPD exacerbation. Exacerbations can be treated with steroids and/or antibiotics. Since no signs of infection (no purulent sputum), antibiotics may not be needed. So steroids (E) could be considered. 

But the answer options include adding tiotropium (D) or starting inhaled corticosteroids (C). Inhaled corticosteroids are for maintenance, not acute exacerbations. So for an acute exacerbation, oral steroids (E) would be better. But if the patient is having a chronic worsening, maybe optimizing maintenance therapy. 

Alternatively, the patient's current regimen might be insufficient. If he's only on short-acting bronchodilators, adding a long-acting one (like tiotropium) would help. 

So the options are D, F, E, G. 

The patient's ejection fraction is 30%, which is heart failure. Beta-agonists (like LABAs) can cause tachycardia, which might be bad in heart failure. Tiotropium (anticholinergic) is a LAMA and doesn't have those effects. So in this patient with HFrEF, adding tiotropium (D) would be safer than a LABA (F). 

So the answer is D. Add tiotropium to current regimen.
</think>

Answer: D",Incorrect
