id,dataset,question,ground_truth_answer,nvidia_model,nvidia_parsed_answer,nvidia_raw_response,nvidia_outcome
Text-37,medxpertqa,"A 75-year-old man with a medical history of hypertension, type 2 diabetes, and coronary artery disease presents with progressively worsening shortness of breath over the past two months. He has a 45-pack-year smoking history and has only lived outside the U.S. briefly during military service in Germany.  

On physical examination, he is afebrile with a respiratory rate of 22 breaths per minute, heart rate of 110 beats per minute, blood pressure of 108/73 mm Hg, and oxygen saturation of 88% on room air. He appears uncomfortable and tachypneic. Auscultation reveals diminished breath sounds, dullness to percussion, and decreased tactile fremitus in the lower third of the left lung field. The right lung is clear to auscultation.  

Chest CT with intravenous contrast shows a large left pleural effusion with no pulmonary parenchymal abnormalities, pleural thickening, or evidence of pulmonary embolism. A diagnostic thoracentesis yields 1400 mL of bloody fluid with the following analysis:  

|  | Patient value |  
| --- | --- |  
| Leukocyte count (per mm³) | 328 |  
| Lymphocytes (%) | 53 |  
| Polymorphonuclear cells (%) | 26 |  
| Monocytes/macrophages (%) | 10 |  
| Mesothelial cells (%) | 10 |  
| Erythrocyte count (per mm³) | 52,476 |  
| Hematocrit (%) | <5 |  
| pH | 7.36 |  
| Lactate dehydrogenase (U/L) | 374 |  
| Total protein (g/dL) | 2.5 |  
| Total glucose (mg/dL) | 127 |  

Pleural fluid Gram stain and cultures are negative. Cytopathology is negative for malignancy, and the adenosine deaminase level is 2 U/L.  

Blood test results are as follows:  

|  | Patient value | Reference range |  
| --- | --- | --- |  
| Leukocyte count (per mm³) | 6700 | 4500–11,000 |  
| Hemoglobin (g/dL) | 9.0 | 13.5–17.5 |  
| Hematocrit (%) | 27.8 | 41.0–53.0 |  
| Lactate dehydrogenase (U/L) | 375 | 100–190 |  
| Total protein (g/dL) | 5.4 | 5.5–8.0 |  

What is the most appropriate next step to determine the cause of this patient’s pleural effusion?
Answer Choices: (A) Pleural fluid amylase measurement (B) Positron emission tomography (PET) scan (C) Closed pleural biopsy (D) Serum protein electrophoresis (E) Bronchoscopy (F) Interferon-gamma release assay of blood (G) Repeat thoracentesis with cytopathologic study (H) Pleural fluid flow cytometry (I) Video-assisted thoracoscopic surgery (VATS) (J) Echocardiography",G,deepseek-ai/deepseek-r1,I,"<think>
Okay, let's tackle this question. So, the patient is a 75-year-old man with a history of hypertension, diabetes, and coronary artery disease. He's been having worsening shortness of breath for two months. He's a heavy smoker with a 45-pack-year history. His physical exam shows signs of a left pleural effusion—diminished breath sounds, dullness to percussion, decreased tactile fremitus. The CT confirms a large left pleural effusion without any parenchymal issues, pleural thickening, or PE. The thoracentesis results show bloody fluid. Let's look at the fluid analysis.

The pleural fluid has a leukocyte count of 328, which is not super high. Lymphocytes are 53%, which is a bit elevated. The RBC count is 52,000—so it's a hemorrhagic exudate. The LDH is 374, which is higher than the serum's upper limit (190). The fluid protein is 2.5 g/dL, which is lower than the serum's 5.4. Wait, Light's criteria for exudate vs transudate. Let me recall: if the fluid protein/serum protein ratio is >0.5, or LDH ratio >0.6, or fluid LDH >2/3 upper limit of serum. Here, fluid protein is 2.5, serum 5.4. 2.5/5.4 is ~0.46, which is less than 0.5. But the LDH in fluid is 374, which is way higher than the serum upper limit (190). So according to Light's criteria, even if the protein ratio is low, if the LDH is high, it's exudative. So this is an exudative effusion.

The fluid is bloody. Causes of hemorrhagic exudative effusion include malignancy, trauma, pulmonary embolism, tuberculosis, etc. But the CT shows no PE. Cytopathology is negative for malignancy. Gram stain and cultures are negative. Adenosine deaminase (ADA) is low (2 U/L), which makes TB less likely. So TB and malignancy are possible but initial tests are negative. The patient's history includes smoking, which raises the possibility of lung cancer. But the CT didn't show any masses. However, sometimes mesothelioma or other pleural-based malignancies might not show up as a mass but cause effusion. Also, the pleural fluid analysis here: the presence of mesothelial cells (10%)—but in TB or malignancy, mesothelial cells are usually low. Wait, but in TB, lymphocytes are predominant. Here, lymphocytes are 53%, which is a majority but not extremely high. The ADA is low, which is against TB. So TB is less likely.

The patient's blood tests show low hemoglobin (9.0) and hematocrit (27.8), which could be due to chronic disease or blood loss. The pleural fluid's hematocrit is <5%, but the fluid is bloody. Wait, the serum hematocrit is 27.8%, and the fluid's is <5%. So the ratio is less than 0.5 (5/27.8 is about 0.18), which suggests that the blood in the fluid is not due to acute hemorrhage (which would have a ratio closer to blood). So this is an exudative, bloody effusion but not acute bleeding. So possible causes could be malignancy, especially if the initial cytology is negative. Sometimes, the first cytology is negative in up to 60% of malignant effusions. So maybe a repeat thoracentesis? But the options include (G) Repeat thoracentesis with cytopathologic study and (I) VATS. Alternatively, closed pleural biopsy (C) or VATS.

The options given are A to J. Let's look at the answer choices. The question is asking for the next step to determine the cause. The initial thoracentesis was done, and cytopathology was negative. So what's next? If the first cytology is negative, the next step could be a repeat thoracentesis, but the yield increases only slightly. Alternatively, a closed pleural biopsy (like Abrams needle) or VATS. Closed biopsies have lower sensitivity compared to VATS. VATS allows for direct visualization and larger biopsies. However, in some cases, if the patient is high risk (like with CAD, older age), maybe less invasive first. But the patient's presentation is concerning for malignancy, given his smoking history. The CT didn't show any masses, but sometimes mesothelioma or other pleural diseases can present with effusion without a mass. The pleural fluid analysis here: the presence of mesothelial cells (10%)—mesothelioma can have mesothelial cells, but reactive effusions can too. The LDH is high, which is a marker for exudates and can be seen in malignancy. The low glucose is not present here (glucose is 127, which is normal). So maybe not rheumatoid or empyema.

So, given that the initial cytology is negative, the next step would be to get a biopsy of the pleura. Closed pleural biopsy (C) or VATS (I). Closed biopsy is less invasive but has lower sensitivity. VATS is more invasive but has higher diagnostic yield, especially for malignancy. The patient's age and comorbidities (CAD, hypertension, diabetes) might make VATS riskier, but if the effusion is undiagnosed and malignancy is suspected, VATS might be the best next step. Alternatively, some sources suggest that if the first cytology is negative, a repeat thoracentesis (G) can be done, but the yield is only about 30% on the second attempt. However, in this case, the effusion is large, and maybe a repeat is possible, but given that the first was negative, perhaps moving to biopsy is better.

Another point: the pleural fluid has a high RBC count. Malignant effusions can be bloody. The absence of mesothelial cells can sometimes be a clue (but here it's 10%). Wait, in TB, mesothelial cells are usually <5%, but here it's 10%. In malignancy, mesothelial cells can vary. But the ADA here is very low (2), which makes TB very unlikely. So the main differential is malignancy vs other exudative causes. The patient's history of smoking and age makes malignancy a prime suspect. The CT didn't show any masses, but some malignancies (like mesothelioma or lymphoma) can present with effusion without a mass. Also, the pleural thickening mentioned in the CT? Wait, the CT says ""no pleural thickening"". So no pleural thickening, no parenchymal abnormalities. So maybe a malignancy that's not visible on CT? Or maybe a non-malignant cause.

Other possibilities: heart failure? But the effusion is exudative. Hypoproteinemia? The serum protein is 5.4, which is low (reference 5.5-8.0), so just below normal. But the fluid is exudative. So maybe transudative if the serum protein is low. Wait, but according to Light's criteria, even if the serum protein is low, the LDH in the fluid is high enough to make it exudative. So transudative causes are less likely here.

Another thought: the patient's blood LDH is 375, which is elevated. The pleural fluid LDH is 374, which is almost the same as serum. So the ratio of fluid LDH to serum upper limit is 374/190 ~1.97. Light's criteria for exudate is fluid LDH >2/3 of the upper limit of serum. So 2/3 of 190 is ~126.7. 374 is way higher. So definitely exudative.

Possible causes of exudative effusion with negative cytology and cultures: TB, malignancy, or other less common causes like rheumatoid, lupus, etc. But the ADA is low, making TB unlikely. So malignancy is high on the list. If the initial cytology is negative, the next step is to get a pleural biopsy. Closed pleural biopsy (C) or VATS (I). Closed biopsies have a sensitivity of around 50-60% for malignancy, whereas VATS has higher sensitivity. So in a patient where malignancy is suspected but initial tests are negative, VATS is the gold standard. However, the patient's comorbidities may influence the decision. But given the answer choices, (I) VATS is an option. Alternatively, closed pleural biopsy (C) is another option. But which is more appropriate?

In current practice, when a patient has an undiagnosed exudative effusion with high suspicion for malignancy and initial cytology negative, the next step is often a closed pleural biopsy. However, some studies suggest that closed biopsy has lower yield compared to image-guided biopsies or VATS. If the CT didn't show any pleural abnormalities (like thickening or nodules), a closed biopsy might not be as effective. VATS allows for direct visualization and biopsy of any suspicious areas, even if the CT didn't show them. So in this case, since the CT shows no pleural thickening, maybe a closed biopsy would not be as helpful, and VATS would be better. But the answer options include (C) and (I).

Alternatively, maybe the answer is (I) VATS. Because closed biopsies are less sensitive, especially if there's no pleural thickening. The patient's effusion is large, and VATS would allow for both biopsy and possible pleurodesis if needed. So the most appropriate next step is VATS. So the answer would be (I). But let's check the other options.

Other answer options: (G) Repeat thoracentesis. The first cytology was negative. Repeating might increase the yield, but not as much as biopsy. (E) Bronchoscopy: if there's a parenchymal lesion, but CT shows no abnormalities. (J) Echocardiography: to check for CHF, but the effusion is exudative. (F) Interferon-gamma release assay: for TB, but ADA is low. (D) Serum protein electrophoresis: maybe for multiple myeloma, but the total protein is low. (A) Amylase: if pancreatitis or esophageal rupture, but the fluid is bloody and amylase is not mentioned. (B) PET scan: might show metabolic activity in malignancy, but not definitive. (H) Flow cytometry: for lymphoma, but the lymphocytes are 53%, which is not extremely high. 

So, considering all, the best next step is VATS (I) to obtain a biopsy. Closed pleural biopsy (C) is an option, but in the absence of pleural thickening, its yield is lower. Therefore, VATS would be more appropriate.
</think>

Answer: I",Incorrect
Text-38,medxpertqa,"What is correct regarding the clinical effects of inhaled anesthetics when administered at high altitudes?
Answer Choices: (A) Desflurane set at a concentration of 5% is delivering the same partial pressure of gas at sea level and at higher altitude. (B) Isoflurane set at a concentration of 1% has the same clinical effect at sea level and at higher altitude. (C) Isoflurane set at a concentration of 1% is delivering the same volume concentration of gas at sea level and at higher altitude. (D) The clinical effect of inhaled anesthetics is independent of altitude due to compensatory physiological mechanisms. (E) Isoflurane set at 1% delivers a lower partial pressure at high altitude but maintains the same clinical effect. (F) Desflurane at 6% delivers a higher partial pressure at higher altitudes compared to sea level. (G) Desflurane at 5% produces a stronger anesthetic effect at higher altitudes due to reduced atmospheric pressure. (H) The partial pressure of isoflurane decreases at higher altitude, reducing its clinical effect. (I) Inhaled anesthetics require higher concentrations at high altitude to achieve the same clinical effect as at sea level. (J) The volume percentage of desflurane required for anesthesia decreases at higher altitudes.",B,deepseek-ai/deepseek-r1,H,"<think>
Okay, let's tackle this question about inhaled anesthetics at high altitudes. Hmm, I remember that partial pressure is key here. So, the question is asking which statement is correct regarding their clinical effects when administered at high altitudes.

First, I need to recall how altitude affects atmospheric pressure. At higher altitudes, the atmospheric pressure is lower. Anesthetic machines deliver a certain volume percentage (like 1% isoflurane), but the actual partial pressure of the gas depends on the ambient pressure. Partial pressure is what determines the clinical effect because it's the driving force for the gas to move into the blood and tissues.

So, let's look at the options. 

Option A says Desflurane at 5% delivers the same partial pressure at sea level and high altitude. Wait, if the atmospheric pressure is lower, then the partial pressure would be lower. Because partial pressure = (percentage concentration) × total pressure. So if total pressure (like at high altitude) is lower, then the same percentage would result in a lower partial pressure. So A is incorrect. 

Option B: Isoflurane 1% has same clinical effect. But if the partial pressure is lower at high altitude, the effect would be less. So B is wrong. 

Option C: Isoflurane 1% same volume concentration. Well, the volume concentration (percentage) is set by the machine. So even at high altitude, the machine would deliver 1% of the total gas. But the total pressure is lower, so the partial pressure (which is 1% of the lower total pressure) would be lower. So C is correct in saying the volume concentration is same. Wait, but the question is about clinical effects. So C is a true statement, but does it answer the question? The question is about clinical effects. So C is correct in terms of delivery, but the clinical effect depends on partial pressure. So if the volume concentration is same, but partial pressure is lower, then the effect would be less. So maybe the answer is not C. Let me check other options.

Option E: Isoflurane 1% delivers lower partial pressure but same effect. Wait, no. If partial pressure is lower, the effect would be less. So to get the same effect, you need a higher percentage. So E is incorrect. 

Option H: Partial pressure decreases, reducing effect. That makes sense. Because at high altitude, same % gives lower partial pressure. So H would be correct. But wait, let me check other options. 

Option I: Require higher concentrations. Yes, because to achieve the same partial pressure as at sea level, you need a higher percentage. For example, at sea level, 1% of 760 mmHg is 7.6 mmHg. At high altitude, say 500 mmHg, to get 7.6 mmHg, you need 7.6 / 500 = 1.52% concentration. So you need higher concentration. So I would be correct. But the options: I says ""require higher concentrations at high altitude to achieve same effect"". So that's correct. But wait, the question is which statement is correct. Let me check all options again.

Option J: Volume percentage required decreases. No, opposite. You need higher percentage. So J is wrong.

Option G: Desflurane 5% produces stronger effect. If the partial pressure is lower, then effect is weaker. But wait, if the machine is set to 5% at high altitude, the partial pressure would be 5% of the lower atmospheric pressure. So lower than at sea level. So effect would be weaker, not stronger. So G is wrong.

Option F: Desflurane 6% higher partial pressure at high altitude. No, because higher altitude has lower total pressure, so 6% of a lower pressure would be lower partial pressure. So F is wrong.

Option D: Clinical effect independent due to compensation. I don't think so. The body's compensation (like lower oxygen) doesn't directly affect the anesthetic's partial pressure. So D is incorrect.

So, the correct options are H and I. Wait, but let's check again. 

H says the partial pressure of isoflurane decreases at higher altitude, reducing effect. That's correct. Because if you set the same percentage, the partial pressure is lower. So the effect is reduced. So H is correct.

I says you need higher concentrations. Which is also correct. So which one is the correct answer?

Wait, the answer options are A to J. Let me check the options again.

The question is asking which is correct regarding the clinical effects. So if H is correct, then that's the answer. But let's see the options again.

Option B: Isoflurane 1% same effect. No, because partial pressure is lower. So effect is less. So B is wrong.

Option C: same volume concentration. That's true, but the question is about clinical effects. So C is a true statement but not about the effect. The effect is determined by partial pressure, not volume concentration. So C is correct in its statement but not the answer to the question. The question is about clinical effects. So the correct answer would be H or I.

Wait, the question is about what is correct regarding the clinical effects. So H says the partial pressure decreases, reducing effect. So if the machine is set to 1% at high altitude, the partial pressure is lower, so the effect is less. Therefore, the clinical effect is reduced. So H is correct.

But option I says that you need higher concentrations. Which is also correct. So which one is the correct answer?

Wait, the answer options can't have two correct answers. Let me check the options again.

Option H: The partial pressure of isoflurane decreases at higher altitude, reducing its clinical effect. That's correct. Because the same % setting would result in lower partial pressure, leading to less effect.

Option I: Inhaled anesthetics require higher concentrations at high altitude to achieve same effect. That's also correct. Because to get the same partial pressure, you need a higher percentage. So both H and I are correct statements. But the answer options are A-J, so perhaps only one is correct.

Wait, the options are presented as possible answers. Let me check again.

Wait, the question is which is correct. So if H is correct, then that's the answer. But let's check the options again.

Wait, the answer options are (A) through (J). Let me re-express the options.

Option H: The partial pressure of isoflurane decreases at higher altitude, reducing its clinical effect. So if the machine is set to 1% at high altitude, the partial pressure is lower (since total pressure is lower), so the effect is reduced. So H is correct.

Option I: Inhaled anesthetics require higher concentrations at high altitude to achieve same effect. This is also correct. Because to get the same partial pressure as at sea level, you need a higher percentage. So if the effect is based on partial pressure, then you need higher concentration at altitude. So both H and I are correct. But how can that be?

Wait, perhaps the answer is H. Let me think again. The question is about the clinical effects when administered at high altitudes. So if the anesthesiologist sets the same concentration (e.g., 1% isoflurane) at high altitude, the partial pressure is lower, so the effect is less. Therefore, the clinical effect is reduced. So H is correct.

Option I says that you need higher concentrations. That's true, but the question is about what is correct when they are administered. So if the question is about the effect when administered (i.e., same concentration), then H is correct. If the question is about what you need to do, then I is correct. The question states ""when administered at high altitudes"" — so if they are set to the same concentration, then the effect is less. So H is correct. But option I is a correct statement as well. Are both H and I correct?

Wait, the options are presented as possible answers. Let me check the options again.

The options are:

A. Desflurane set at 5% same partial pressure. No, because partial pressure would be lower.

B. Isoflurane 1% same effect. No, effect is less.

C. Isoflurane 1% same volume concentration. Yes, but that's about delivery, not effect.

D. Clinical effect independent. No.

E. Isoflurane 1% lower partial pressure but same effect. No, effect is less.

F. Desflurane 6% higher partial pressure. No, lower.

G. Desflurane 5% stronger effect. No, weaker.

H. Partial pressure decreases, effect reduced. Correct.

I. Require higher concentrations. Correct, but this is a different statement. The question is about the effect when administered (i.e., same concentration). So if you set the same concentration, the effect is less (H). If you want same effect, you need higher concentration (I). So the correct answer depends on the question's phrasing.

The question is: ""What is correct regarding the clinical effects of inhaled anesthetics when administered at high altitudes?"" So when they are administered (i.e., set to the same concentration), the effect is less. So H is correct. Option I is about what you need to do to achieve the same effect, which is a different scenario. So H is correct.

But wait, let's check option B again. B says isoflurane 1% has same clinical effect. That's wrong. So H is correct. So the answer is H.
</think>

Answer: H",Incorrect
