id,dataset,question,ground_truth_answer,nvidia_model,nvidia_parsed_answer,nvidia_raw_response,nvidia_outcome
index_220,mmlu_clinical_knowledge,What is meant by the term 'passive movements'?,D,deepseek-ai/deepseek-r1,D,"<think>
Okay, let's tackle this question about passive movements. Hmm, I need to remember what passive movements are. From what I learned in anatomy or physical therapy classes, passive movements are when someone else moves a part of your body for you, right? Like when a physical therapist moves your arm or leg without you actively doing the movement yourself.

So the options here are about resistance and whether they stretch at the end of the range or stop. Let me think. Passive movement is when the patient isn't using their muscles; the movement is done by an external force. So there shouldn't be any resistance because the person isn't contracting their muscles. That would eliminate options A and C because they mention resistance. So now it's between B and D.

Now, the other part: stretching at the end of range versus stopping. Passive movements can sometimes involve stretching to maintain or improve the range of motion. If the therapist moves the joint through its available range and maybe holds a stretch at the end, that would be stretching. But if they just move it without going into a stretch, they stop at the end. Wait, I think passive movements can be either just moving through the existing range without stretching, or sometimes they do stretch. But in the definition, maybe the key is whether stretching is part of it. 

Wait, maybe the standard definition is that passive movement is movement applied by an external force without the patient's effort, and it can be within the available range (so stopping at the end) or stretching beyond (which would be passive stretching). But the question is about passive movements in general. So if the options are B and D: B says movement without resistance and stretching at end, D is movement without resistance and stopping at end. 

I think passive movement typically refers to moving the joint through its existing range without forcing beyond, so stopping at the end. Stretching at the end might be considered a different technique, like passive stretching. So maybe the correct answer is D. But I'm a bit confused here. Let me check. 

Another angle: active movement is when the patient moves themselves, passive is when someone else does it. Active-assisted is with some help. Passive movements are used when the patient can't move the limb themselves, maybe after injury. The purpose is to maintain joint mobility without causing strain. So if you move the joint through its normal range without adding stretch, that's passive movement. If you go beyond to stretch, that's passive stretching. So the term 'passive movements' would be without resistance and stopping at the end. So option D. But wait, some sources might say that passive movements can involve stretching. Hmm. 

Alternatively, maybe in some contexts, passive movement includes stretching. Let me think. For example, in range of motion exercises, passive ROM is when the therapist moves the joint through its full range, which might include the end range but not necessarily stretching beyond. Stretching would be a separate intervention. So the answer would be D: movement without resistance, stopping at end of range. 

But I'm not 100% sure. Let me recall. The key points are: passive movement is performed by an external force, no voluntary muscle contraction, so no resistance. So options B and D. Then, does passive movement involve stretching at the end? If it's just moving through the available range, then stopping. Stretching would be when you apply a gentle stretch beyond the current range to increase flexibility. So maybe B is passive stretching, and D is passive movement. Therefore, the correct answer is D.
</think>

The term 'passive movements' refers to movements performed by an external force without voluntary muscle contraction from the patient. Since there is no active participation, there is no resistance. Passive movements typically involve moving a joint through its existing range of motion without forcing beyond its current limits, which means stopping at the end of the range rather than stretching. Stretching at the end would fall under a separate category, such as passive stretching. Therefore, the correct answer is **D**. 

[D]",Correct
index_221,mmlu_clinical_knowledge,What is a tracheostomy?,B,deepseek-ai/deepseek-r1,B,"<think>
Okay, let's tackle this question about what a tracheostomy is. I remember from my anatomy classes that the trachea is the windpipe, right? So a tracheostomy must involve creating an opening in the trachea. The options mention different locations: anterior wall, posterior wall, and positions relative to the cricoid cartilage.

First, I need to recall where the cricoid cartilage is. The cricoid is the ring-shaped structure that sits below the thyroid cartilage (which is the Adam's apple). It's the only complete ring in the trachea, I think. So the cricoid cartilage is a key landmark here. 

Tracheostomy procedures usually involve making an incision in the neck to access the trachea. The standard practice is to make the opening below the cricoid cartilage. Why? Because above the cricoid, there's the thyroid cartilage, and cutting through that might cause more complications. The cricoid is a complete ring, so going below it would be safer and avoid damaging the vocal cords or other structures higher up.

Looking at the options: A says above the cricoid, B says below. So between A and B. The other options, C is about the chest wall, which doesn't make sense because tracheostomy is in the neck. D mentions the posterior wall, but the trachea's posterior wall is near the esophagus. Making an opening there would risk connecting to the esophagus, which is not the intention. So D is out. C is also incorrect because the chest wall is lower, maybe referring to a thoracostomy or something else.

So the correct answer should be B: an opening in the anterior wall of the trachea below the cricoid cartilage. That aligns with the standard procedure where the incision is made below the cricoid to avoid the thyroid cartilage and vocal cords. Let me double-check. Yes, the tracheostomy is typically performed between the second and third tracheal rings, which are below the cricoid. So B is correct.
</think>

The correct answer is B. A tracheostomy involves creating an opening in the anterior wall of the trachea **below the cricoid cartilage** to establish an airway. This location avoids critical structures like the thyroid cartilage and vocal cords, which lie above the cricoid. Options C and D are anatomically incorrect, as tracheostomies are not performed on the chest wall or posterior trachea. Option A incorrectly places the opening above the cricoid. [B]",Correct
index_222,mmlu_clinical_knowledge,Which of the following is true of haematemesis?,A,deepseek-ai/deepseek-r1,A,"<think>
Okay, let's tackle this question about haematemesis. So, the question is asking which of the options is true regarding haematemesis. The options are A to D. Let me think through each one step by step.

First, I need to recall what haematemesis is. Haematemesis is the vomiting of blood, which usually indicates bleeding from the upper gastrointestinal tract, like the esophagus, stomach, or duodenum. Common causes include peptic ulcers, gastritis, esophageal varices (which are often related to liver cirrhosis, so alcohol could be a factor here), and Mallory-Weiss tears.

Now, let's look at each option:

Option A: ""A low blood pressure (<90mmHg systolic) and a tachycardia (>100/min) are worrying features."" Hmm. In cases of acute upper GI bleeding, signs of hypovolemia like hypotension and tachycardia are indeed concerning. These are signs that the patient might be going into shock due to blood loss. So low BP and high heart rate would indicate significant blood loss, which is a worrying sign. This makes sense. So A might be correct.

Option B: ""A pulse rate of 80/min in a patient taking Bisoprolol is reassuring."" Bisoprolol is a beta-blocker, which lowers heart rate. So if a patient is on Bisoprolol, their heart rate might not increase as expected even if they're hypovolemic. Normally, with blood loss, you'd expect tachycardia, but beta-blockers can mask this by keeping the heart rate lower. So a pulse of 80 might not be reassuring because the patient's actual compensatory response is being masked. Therefore, B is probably not correct. The pulse rate here might be falsely reassuring.

Option C: ""Abdominal pain is always present."" I don't think this is true. For example, in cases of esophageal varices, which can rupture and cause massive bleeding, there might not be significant abdominal pain. Similarly, some patients with chronic ulcers might not have acute pain during bleeding. So C is likely incorrect because abdominal pain isn't a universal symptom.

Option D: ""An alcohol history is not essential."" Wait, alcohol use is a significant risk factor for conditions like gastritis, esophageal varices (due to liver cirrhosis), and other GI issues. Taking a thorough history, including alcohol use, is important in determining the cause of haematemesis. So not taking an alcohol history would be a mistake. Therefore, D is incorrect because an alcohol history is essential.

So putting it all together: A is correct because hypotension and tachycardia are worrying signs. B is incorrect because beta-blockers can mask the true heart rate response. C is wrong because abdominal pain isn't always present. D is wrong because alcohol history is important. Therefore, the correct answer should be A.
</think>

[A]",Correct
index_223,mmlu_clinical_knowledge,Which of the following is true of rheumatoid arthritis?,C,deepseek-ai/deepseek-r1,C,"<think>
Okay, let's tackle this question about rheumatoid arthritis. Hmm, I need to figure out which of the options A to D is correct. Let me start by recalling what I know about rheumatoid arthritis (RA).

First, RA is an autoimmune disease that primarily affects the joints. It's a type of inflammatory arthritis. Let's go through each option one by one.

Option A says ""Rheumatoid factor is present in 25% of rheumatoid cases."" Wait, I remember that rheumatoid factor (RF) is an antibody found in many RA patients. But isn't the percentage higher than 25%? I think about 70-80% of RA patients test positive for RF. So if that's the case, then option A is incorrect because it states 25%, which is too low. So A is probably wrong.

Option B: ""It is an example of an oligoarthropathy."" Oligoarthropathy refers to arthritis affecting a few joints, typically 2-4. But RA is a polyarthritis, meaning it affects multiple joints, usually in a symmetrical pattern. So oligoarthropathy would be more like juvenile idiopathic arthritis or reactive arthritis sometimes. So B is incorrect.

Option C: ""Anaemia is a common finding."" RA is a chronic inflammatory condition. Chronic inflammation can lead to anemia of chronic disease. The body's iron metabolism gets disrupted, leading to anemia. So yes, anemia is commonly associated with RA. I think this is correct. So C might be the right answer.

Option D: ""Heberden's nodes are a feature."" Heberden's nodes are bony enlargements in the distal interphalangeal joints (DIP joints), which are characteristic of osteoarthritis, not RA. RA typically affects the proximal interphalangeal (PIP) joints and metacarpophalangeal (MCP) joints. So D is incorrect.

Putting it all together: A is wrong (RF is higher), B is wrong (it's poly, not oligo), C is correct (anemia common), D is wrong (Heberden's nodes are OA). So the correct answer should be C.
</think>

The correct answer is C. Anaemia is a common finding in rheumatoid arthritis due to chronic inflammation disrupting iron metabolism (anemia of chronic disease). 

- **A** is incorrect because rheumatoid factor is present in ~70-80% of cases, not 25%.  
- **B** is incorrect because RA is a *polyarthropathy* (affects multiple joints), not an oligoarthropathy.  
- **D** is incorrect because Heberden’s nodes are associated with osteoarthritis, not RA.  

[C]",Correct
index_224,mmlu_clinical_knowledge,Why should careful consideration be given to providing people aged over 65 with information sources that are internet based?,B,deepseek-ai/deepseek-r1,B,"<think>
Okay, let's tackle this question. The question is asking why we should be careful when giving internet-based information sources to people over 65. The options are A to D.

First, I need to understand each option. Let's go through them one by one.

Option A says they may have difficulty reading the screen. That makes sense because older adults might have vision issues, but is that the main reason the question is focusing on? Maybe, but maybe there's a better answer.

Option B states that less than 30% of people over 65 have internet access. If that's the case, then providing internet-based sources might not reach most of them. That seems like a strong reason. But wait, is the percentage accurate? I think in some countries, internet usage among seniors is increasing, but maybe in some regions it's still low. The question doesn't specify a location, so assuming general, maybe B is correct.

Option C claims the internet is aimed at younger people. While some platforms target younger demographics, the internet itself is used by all ages. So maybe this is a stereotype and not the best answer.

Option D suggests they might not be able to type. Typing difficulties could be a barrier, but some seniors can use touchscreens or voice commands. Also, maybe not being able to type is a subset of a larger access issue.

Now, the key here is the reason for careful consideration. If a significant portion of the over-65 population lacks internet access (option B), then providing info online would exclude many. That's a major accessibility issue. Even if some have vision problems (A) or typing issues (D), the main barrier would be lack of access. So B seems like the best answer. But wait, I should check if the statistic in B is accurate. The question is hypothetical, so the options are given as possible reasons regardless of real-world stats. So even if in reality the percentage is higher, the question presents B as a fact here. Therefore, if B is true (as per the question's context), then that's a valid reason. So the answer would be B.
</think>

The correct answer is B because if less than 30% of people over 65 have internet access, providing information primarily through internet-based sources would exclude the majority of this demographic, necessitating careful consideration of alternative methods. [B]",Correct
index_225,mmlu_clinical_knowledge,Which of the following is true about the carpal tunnel syndrome?,A,deepseek-ai/deepseek-r1,A,"<think>
Okay, let's tackle this question about carpal tunnel syndrome. Hmm, I need to remember what I learned about this. Carpal tunnel syndrome is a common condition affecting the hand, right? Let me think.

First, the options are A to D. Let's go through each one. 

Option A says it can be caused by rheumatoid arthritis. I recall that rheumatoid arthritis is an inflammatory condition that can cause swelling in the joints. The carpal tunnel is a narrow passageway in the wrist, so if there's inflammation from RA, that swelling could compress the median nerve inside the tunnel. That makes sense. So A might be correct.

Option B states it's caused by compression of the ulnar nerve. Wait, the ulnar nerve runs through the cubital tunnel in the elbow, right? Carpal tunnel syndrome involves the median nerve, not the ulnar. The ulnar nerve issues would cause symptoms in the little finger and part of the ring finger, like in cubital tunnel syndrome. So B is probably incorrect.

Option C mentions pain and tingling in the medial three and a half digits. The median nerve innervates the thumb, index, middle, and half the ring finger. Medial three and a half would be the little finger and half the ring, which is the ulnar nerve's territory. So C is mixing up the nerves. Carpal tunnel affects the lateral (radial) side, so the first three and a half fingers. Therefore, C is wrong.

Option D says paraesthesia is worse during the day. But I remember that symptoms of carpal tunnel often worsen at night or in the morning. People might wake up with numbness and shake their hands to relieve it. Daytime activities like typing might aggravate it, but the classic symptom is nighttime worsening. So D is incorrect.

Putting it all together: A is correct because RA can cause swelling leading to carpal tunnel. B is wrong (ulnar vs median), C is wrong (medial vs lateral fingers), D is wrong (night worse, not day). So the answer should be A.
</think>

[A]",Correct
index_226,mmlu_clinical_knowledge,How many CO2 and ATP molecules are formed during one complete turn of the tricarboxylic acid cycle (Krebs' cycle)?,D,deepseek-ai/deepseek-r1,D,"<think>
Okay, let's see. The question is about how many CO2 and ATP molecules are produced in one turn of the Krebs cycle, also known as the tricarboxylic acid cycle. Hmm, I need to remember what happens in each step of the cycle.

First, I recall that the Krebs cycle is part of cellular respiration, specifically the part that happens in the mitochondria. Each turn of the cycle processes one acetyl-CoA molecule. Wait, but each glucose molecule produces two acetyl-CoA, so maybe the question is per acetyl-CoA, which would be one turn. 

So, during the cycle, there are several reactions. Let me think. The cycle starts with acetyl-CoA combining with oxaloacetate to form citrate. Then through a series of steps, it gets broken down. The key points where CO2 is released—I think there are two steps where CO2 is produced. For example, when isocitrate is converted to alpha-ketoglutarate, and then alpha-ketoglutarate to succinyl-CoA. Each of those steps releases one CO2 molecule. So that's two CO2 per cycle. That matches some of the options given. All the options start with 2CO2, so that part seems consistent.

Now for ATP. The Krebs cycle generates ATP through substrate-level phosphorylation. I remember that in one turn, there's one step where GTP is produced, which is equivalent to ATP. So maybe that's where the ATP count comes in. Wait, the question specifically asks for ATP, but sometimes GTP is considered here. In some textbooks, they might convert GTP to ATP, so that would be 1 ATP (or GTP) per cycle. But wait, some sources might say directly 1 ATP. Let me check. Yes, in the Krebs cycle, the step where succinyl-CoA is converted to succinate produces GTP (in some cells) or ATP (in others), but regardless, it's counted as one ATP equivalent per turn. So that would be 1 ATP per cycle. 

But wait, the options have D as 2CO2 and 1ATP. So that would be option D. But I need to make sure. Let me think again. The options are A: 2 and 2, B: 2 and 16, C: 2 and 12, D: 2 and 1. So the CO2 is definitely 2 per cycle. The ATP is 1. So D is the answer. 

But wait, sometimes people get confused between the cycle per glucose and per acetyl-CoA. Since one glucose gives two acetyl-CoA, so two turns of the cycle. So if the question is per glucose, then it would be double. But the question says ""one complete turn"", which is per acetyl-CoA. So per turn, 2 CO2 and 1 ATP. So the answer is D. 

But wait, I've heard that some textbooks or sources might mention that the Krebs cycle itself produces 1 ATP (or GTP) per turn, but when considering the electron carriers (NADH and FADH2), those contribute to ATP production via the electron transport chain. However, the question specifically asks about ATP molecules formed during the cycle, which would be the substrate-level ones, not the ones from oxidative phosphorylation. So the answer should be D. 

Yes, that makes sense. So the correct answer is D.
</think>

The tricarboxylic acid (Krebs) cycle produces **2 CO₂ molecules** per turn through decarboxylation reactions during the conversion of isocitrate to α-ketoglutarate and α-ketoglutarate to succinyl-CoA. For ATP, **1 molecule** (or GTP, which is functionally equivalent) is generated via substrate-level phosphorylation when succinyl-CoA is converted to succinate. The question specifies ATP formed *directly in the cycle*, excluding contributions from NADH/FADH₂ (which drive ATP synthesis later in oxidative phosphorylation). 

**Answer:** [D]",Correct
index_227,mmlu_clinical_knowledge,"Which potential complication of IV therapy is described thus: 'Leakage of vesicant (irritant) medication or fluid into surrounding tissues, causing tissue damage'?",A,deepseek-ai/deepseek-r1,A,"<think>
Okay, let's tackle this question. The question is about a complication of IV therapy where vesicant medication or fluid leaks into surrounding tissues, causing damage. The options are Extravasation, Phlebitis, Inflammation, and Infiltration.

First, I need to remember what each term means. Let's start with the key terms here. Vesicant medications are those that can cause blistering or tissue damage if they escape the vein. So the complication here is specifically about such medications leaking into the tissues.

Infiltration is when IV fluids or non-vesicant medications leak into the surrounding tissue. That's different because infiltration can cause swelling and discomfort but isn't necessarily as severe as when a vesicant is involved. So if the fluid is a vesicant, the term might be different.

Extravasation, I think, refers specifically to the leakage of vesicant or irritant substances into the tissue. That's more severe because those substances can cause necrosis or serious damage. So extravasation would be the correct term here.

Phlebitis is inflammation of the vein, which can happen from the IV catheter itself or certain medications. It's more about the vein being irritated rather than the medication leaking into the tissue. Inflammation is a general term and not specific enough for this scenario.

So putting it all together: the question describes extravasation because it's about vesicant medications causing tissue damage upon leakage. Infiltration is for non-vesicant leaks. Therefore, the answer should be A. Extravasation.
</think>

The complication described involves the leakage of vesicant (tissue-damaging) substances into surrounding tissues, which is specifically termed **extravasation**. Infiltration (D) refers to non-vesicant fluid leakage, phlebitis (B) is vein inflammation, and inflammation (C) is too general. 

[A]",Correct
index_228,mmlu_clinical_knowledge,Which of the following is present in saliva and has an antibacterial action?,A,deepseek-ai/deepseek-r1,A,"<think>
Okay, so the question is asking which component in saliva has antibacterial properties. The options are Lysozyme, Amylase, Sodium chloride, and Mucus. Let me think through each one.

First, I remember that saliva contains enzymes. Amylase, option B, is an enzyme that breaks down starches into sugars. That's part of digestion, right? So amylase helps start the digestive process in the mouth. But does it have antibacterial action? I don't think so. Its main role is breaking down carbs, not fighting bacteria.

Then there's sodium chloride, option C. That's basically salt. Saliva does have salts, but sodium chloride's primary function is probably related to maintaining the ionic balance or pH in the mouth. I don't recall salt in saliva being specifically antibacterial. Although salt can have some antimicrobial properties in higher concentrations, like in saline solutions, but in saliva's case, maybe not the main antibacterial agent here.

Mucus, option D. Mucus is produced in various parts of the body, including the mouth. Its role is usually lubrication and protection. It traps particles and maybe pathogens, but does it actively kill bacteria? I think mucus acts more as a physical barrier rather than having an antibacterial enzyme. So maybe not the answer here.

That leaves option A, Lysozyme. I remember that lysozyme is an enzyme that attacks the cell walls of bacteria. Specifically, it breaks down peptidoglycan, which is a component of bacterial cell walls. This action can cause bacteria to lyse, or burst. So lysozyme is part of the body's innate immune system, providing a first line of defense against pathogens. Since saliva is part of the mouth's environment, which is exposed to lots of bacteria, having lysozyme makes sense to help control bacterial growth.

Wait, let me double-check. Amylase is definitely for starch digestion. Sodium chloride is just salt. Mucus is for lubrication. Lysozyme is the enzyme that breaks down bacterial cell walls. Yeah, that sounds right. So the answer should be A, Lysozyme.
</think>

The correct answer is A. Lysozyme. Lysozyme is an enzyme in saliva that breaks down bacterial cell walls (peptidoglycan), providing antibacterial action. Amylase (B) aids in starch digestion, sodium chloride (C) maintains ionic balance, and mucus (D) lubricates and traps particles, but none of these have direct antibacterial roles like lysozyme. [A]",Correct
