id,dataset,question,ground_truth_answer,nvidia_model,nvidia_parsed_answer,nvidia_raw_response,nvidia_outcome
index_99,mmlu_clinical_knowledge,960 mg of the antibacterial drug Cotrimoxazole is prescribed every 12 hours. What is the daily dose in grams? Choose one answer from the following:,B,deepseek-ai/deepseek-r1,B,"<think>
Okay, let's see. The question is about calculating the daily dose of Cotrimoxazole in grams. The prescription is 960 mg every 12 hours. Hmm, so first I need to figure out how much is taken in a day.

Since the dose is every 12 hours, that means the patient takes it twice a day. Right? Because 24 hours divided by 12 hours between doses equals two times a day. So, 960 mg multiplied by 2. Let me do that math. 960 times 2 is 1920 mg. But the question asks for the daily dose in grams. Oh right, I need to convert milligrams to grams. 

Wait, how do I convert mg to grams? I remember that 1 gram is 1000 milligrams. So, to get grams, I divide by 1000. So 1920 mg divided by 1000. Let's calculate that. 1920 divided by 1000 is 1.92 grams. 

Looking at the options, B is 1.92. So the answer should be B. Let me double-check. 960 mg twice a day is 1920 mg total. Convert to grams by dividing by 1000, which gives 1.92 grams. Yep, that's correct. The other options don't make sense. A is 0.192, which is too small. C is 1920, but that's in mg, not grams. D is 0.96, which is just one dose. So definitely B.
</think>

The patient takes 960 mg every 12 hours, which equals two doses per day. Total daily dose in mg:  
960 mg × 2 = **1920 mg**.  

Convert mg to grams (1 g = 1000 mg):  
1920 mg ÷ 1000 = **1.92 g**.  

The correct answer is **B. 1.92**.  

[B]",Correct
index_100,mmlu_clinical_knowledge,Which of the following is true of hypothyroidism?,C,deepseek-ai/deepseek-r1,C,"<think>
Okay, let's tackle this hypothyroidism question. Hmm, hypothyroidism is when the thyroid doesn't produce enough hormones, right? So the symptoms are usually the opposite of hyperthyroidism. Let's go through each option.

Option A: Weight loss. Wait, hyperthyroidism causes weight loss because of increased metabolism. Hypothyroidism would slow metabolism, leading to weight gain. So A is probably not correct.

Option B: Pre-tibial myxoedema. I remember that's more associated with Graves' disease, which is hyperthyroidism. Pre-tibial myxoedema is like swelling in the shins. So B is likely not the answer here.

Option C: Raised TSH level. TSH is thyroid-stimulating hormone. If the thyroid is underactive, the pituitary gland would release more TSH to try to stimulate it. So in primary hypothyroidism, TSH levels are high. That makes sense. So C could be correct.

Option D: Aversion to warm places. Hyperthyroidism makes people heat intolerant, so they prefer cold. Hypothyroidism would make them feel cold, so they might seek warmth. So D is probably not right; they'd have an aversion to cold, not warm. So D is incorrect.

Putting it all together: The correct answer should be C. Raised TSH level.
</think>

The correct answer is C. In hypothyroidism, the thyroid gland underproduces hormones, prompting the pituitary gland to increase TSH secretion to stimulate thyroid activity. Weight gain (not loss), absence of pre-tibial myxoedema (linked to hyperthyroidism), and cold intolerance (not aversion to warmth) further confirm this. 

[C]",Correct
index_101,mmlu_clinical_knowledge,What is hypochlorhydria?,C,deepseek-ai/deepseek-r1,C,"<think>
Okay, so I need to figure out what hypochlorhydria means. Let's break down the word. ""Hypo-"" usually means low or under, right? Like hypothermia is low body temperature. Then ""chlorhydria"" – I think ""chlor"" might relate to chloride, and ""hydria"" could be about water or maybe acid. Wait, gastric acid in the stomach is hydrochloric acid, HCl. So hypochlorhydria would be low hydrochloric acid.

Looking at the options: A is increased, which doesn't fit. B is a gastric ulcer, which is a condition but not directly about acid levels. C is reduced, which matches the ""hypo"" part. D is pernicious anemia, which I remember is related to B12 deficiency due to lack of intrinsic factor, which can be caused by low stomach acid too. But the question is asking for the definition of hypochlorhydria, not a consequence. So the answer should be C. Reduced amount of gastric acid.
</think>

The term hypochlorhydria combines ""hypo-"" (low) and ""chlorhydria"" (related to hydrochloric acid in the stomach). It directly refers to reduced gastric acid production. Among the options, **C** correctly defines this condition. 

Answer: [C]",Correct
index_102,mmlu_clinical_knowledge,"A 67-year-old man, three hours post-transurethral resection of prostate with irrigation, has a blocked catheter. Which solution should be used to complete bladder washout?",B,deepseek-ai/deepseek-r1,B,"<think>
Okay, let's tackle this question. So, the scenario is a 67-year-old man who's three hours post-transurethral resection of the prostate (TURP) and now has a blocked catheter. The question is asking which solution should be used for a bladder washout. The options are Solution R, Normal saline, Solution G, or any of the above.

First, I need to recall what TURP involves. Transurethral resection of the prostate is a surgery to remove part of the prostate gland, usually done to relieve urinary symptoms caused by an enlarged prostate. After TURP, patients typically have a catheter in place to help drain urine and blood clots. Sometimes, the catheter can get blocked, which would require irrigation or washout to clear the blockage.

Now, the key here is knowing what solutions are appropriate for bladder irrigation post-TURP. From what I remember, after TURP, there's a risk of bleeding, and clots can form, leading to catheter blockage. The irrigation solution used is important to prevent complications like clot retention or bladder distension.

Normal saline (0.9% sodium chloride) is a common irrigation solution. But wait, sometimes in certain procedures, they use specific solutions. For example, during TURP, glycine solution is often used as an irrigant during the procedure because it's a non-conductive fluid, which is necessary when using electrocautery. But post-operatively, when doing bladder washouts, the choice might differ.

Wait, but the options here are Solution R, Normal saline, Solution G, or any. Let me think. Solution G is likely Glycine solution. Solution R might be Ringer's solution. But I need to confirm what's standard practice for post-TURP irrigation.

During the surgery, glycine is used because it's hypotonic and doesn't conduct electricity, which is important when using electrical instruments. However, after surgery, when the patient is in recovery and the catheter is in place, the irrigation is usually done with normal saline. The reason is that once the procedure is done, there's no need for the non-conductive solution anymore. Using normal saline helps in maintaining electrolyte balance and is isotonic, which is safer for continuous irrigation to prevent clot formation.

But wait, some sources mention that sterile water or glycine might be used during the procedure, but post-op, normal saline is preferred. However, if the catheter is blocked, maybe the solution used for irrigation depends on the hospital's protocol. But I think the standard answer here is normal saline. Let me check.

Another angle: if the irrigation is done to dissolve clots, normal saline is isotonic and doesn't cause hemolysis. If you use a hypotonic solution like glycine, it might cause issues if absorbed in large amounts, leading to hyponatremia or other electrolyte imbalances. But during the procedure, the risk of absorption is higher, so they use glycine. Post-op, when irrigation is done, the risk of systemic absorption is lower, so normal saline is safer.

So, in the case of a blocked catheter after TURP, the correct solution for bladder washout would be normal saline. Therefore, option B. But wait, some guidelines might mention using sterile water or another solution. Hmm. Wait, maybe Solution R is Ringer's lactate. But Ringer's lactate is similar to normal saline but with added electrolytes. However, for bladder irrigation, normal saline is more commonly used. 

Alternatively, maybe Solution G is Glycine. If the question is from a UK-based source, they might refer to Solution G as Glycine. But in post-op irrigation, after TURP, the standard is normal saline. Because during the procedure, they use glycine to prevent electrical conduction, but after the procedure, when irrigating the bladder to prevent clots, normal saline is used. So the answer would be B. Normal saline.

But wait, I'm a bit confused. Let me think again. If the catheter is blocked due to clots, the irrigation is to remove the clots. Normal saline is isotonic and safe. Using hypotonic solutions like glycine might cause more hemolysis if there's bleeding, but in the bladder, maybe that's not a big issue. However, post-TURP, the irrigation is typically done with normal saline. So the answer should be B. Normal saline. Therefore, the correct option is B.
</think>

The appropriate solution for bladder washout in a patient post-TURP with a blocked catheter is **normal saline**. During the procedure, glycine (Solution G) is used to avoid electrical conduction, but post-operatively, normal saline is preferred for irrigation due to its isotonicity and safety in preventing electrolyte imbalances. Other solutions like Ringer's (Solution R) or glycine are not standard for post-TURP washouts. 

**[B]**",Correct
index_103,mmlu_clinical_knowledge,A keloid is:,B,deepseek-ai/deepseek-r1,B,"<think>
Okay, so I need to figure out what a keloid is. Let me start by recalling what I know about scars and skin conditions. Keloid... I think it's related to scarring. From what I remember, when the skin is injured, the body heals by forming scar tissue. But sometimes, the scar becomes raised and thicker than usual. That might be a keloid.

Looking at the options: A says it's evidence of infection. Hmm, infections can cause redness, pus, maybe, but a keloid is more about excessive scar tissue, not necessarily infection. So maybe A isn't right. B is a firm mass of scar tissue. That sounds like what I was thinking—thick, raised scar. C is a fine, hairline scar. That's the opposite of a keloid. Fine scars are more like normal healing. D says formed if a wound drain is removed too soon. Removing a drain too soon might cause fluid buildup or infection, but a keloid is about scar overgrowth, not drainage issues. So D doesn't fit. 

Wait, keloid is an overgrowth of fibrous tissue. So B is the correct answer. Let me double-check. Keloid vs hypertrophic scar. Both are raised, but keloids extend beyond the original wound. But the question doesn't differentiate between those. The key point is that it's a firm scar mass. So yes, B.
</think>

The correct answer is B. A keloid is characterized by an overgrowth of dense fibrous tissue, forming a firm, raised scar that extends beyond the original wound boundaries. It is not related to infection (A), a fine scar (C), or premature drain removal (D). 

[B]",Correct
index_104,mmlu_clinical_knowledge,Which of the following is not an amino acid?,D,deepseek-ai/deepseek-r1,D,"<think>
Okay, let's see. The question is asking which of the options is not an amino acid. The options are A through D.

First, I need to remember what amino acids are. Amino acids are organic compounds that contain both amino (-NH2) and carboxyl (-COOH) functional groups, along with a side chain specific to each amino acid. They are the building blocks of proteins.

Looking at the options:

A. Glutamic acid. I think glutamic acid is one of the standard amino acids. It's also known as glutamate, right? It has a carboxyl group in its side chain, making it acidic. So A is an amino acid.

B. Aspartic acid. Similarly, aspartic acid is another acidic amino acid. I remember it's also called aspartate. So B is definitely an amino acid.

C. Glutamine. Glutamine is the amide form of glutamic acid. It's one of the 20 standard amino acids encoded by the genetic code. So C is an amino acid as well.

D. Palmitic acid. Hmm, palmitic acid. Wait, palmitic acid sounds familiar. Isn't that a fatty acid? Like a saturated fatty acid with 16 carbons. Fatty acids are part of lipids, not amino acids. They have a long hydrocarbon chain and a carboxyl group, but no amino group. So D is a fatty acid, not an amino acid.

Therefore, the answer should be D. Palmitic acid isn't an amino acid.
</think>

The correct answer is D. Palmitic acid is a saturated fatty acid, not an amino acid, as it lacks an amino group and is instead a component of lipids. 

[D]",Correct
index_105,mmlu_clinical_knowledge,Wound drainage is described as serous if:,D,deepseek-ai/deepseek-r1,D,"<think>
Okay, so I need to figure out which option correctly describes serous wound drainage. Let me start by recalling what serous fluid is. From what I remember in anatomy and physiology, serous fluid is typically a clear, pale yellow liquid. It's produced by the body in various situations, like in serous membranes such as the pleura or pericardium. But how does that relate to wound drainage?

When a wound is healing, different types of exudate can be present. The main types I think are serous, sanguineous, purulent, and maybe others. Let me break them down.

Serous: As I thought, this should be clear or maybe slightly yellowish. It's mostly the liquid part of the blood without the cells. So it's like the plasma that seeps out when there's inflammation but not infection.

Sanguineous: That's related to blood. So if a drainage has red blood cells, it would be sanguineous. That's probably option A. So A is sanguineous, not serous.

Purulent: This is the thick, yellow or green stuff, which is pus. That's usually a sign of infection because it contains dead white cells, bacteria, etc. So option B is purulent. So B is not serous.

Option C says it contains microorganisms. If there's microorganisms, that's more about infection. But serous fluid itself might not necessarily have microorganisms. Infected wounds might have purulent drainage with microorganisms. So C might be related to purulent or infected exudate, not serous.

Option D is clear or slightly yellow. That matches what I remember about serous fluid. So D should be the correct answer.

Wait, let me double-check. Serous drainage is thin and watery, right? Like the fluid in blisters from a burn or a friction blister. That's serous fluid. So yes, clear or slightly yellow. So D is correct. The other options are different types: sanguineous (bloody), purulent (pus), and presence of microorganisms would indicate infection, which is more associated with purulent.
</think>

The correct answer is D. Serous drainage is characterized by being clear or slightly yellow, which aligns with the description of serous fluid as a thin, watery exudate primarily composed of plasma without blood cells or pus. 

- **A (contains red blood cells)**: This describes sanguineous drainage, not serous.  
- **B (thick and yellow/green)**: Indicates purulent drainage, typically a sign of infection.  
- **C (contains microorganisms)**: Associated with infected wounds, often linked to purulent exudate.  
- **D (clear or slightly yellow)**: Correctly matches the definition of serous drainage.  

[D]",Correct
index_106,mmlu_clinical_knowledge,The sex of a child is dictated by the inheritance of:,D,deepseek-ai/deepseek-r1,D,"<think>
Okay, so I need to figure out which option correctly answers the question about what determines the sex of a child. The question is asking which inheritance dictates the sex. The options are A through D.

First, I remember that humans have 23 pairs of chromosomes. The 23rd pair are the sex chromosomes. Females have two X chromosomes (XX), and males have one X and one Y (XY). So the sex of the child depends on whether they receive an X or a Y from the father, right? Because the mother can only give an X, since females have XX. The father can give either X or Y, which determines the sex. Wait, but let me think again. The mother's eggs all have an X chromosome, and the father's sperm can have either X or Y. So if the sperm contributes an X, the child is XX (female), and if it's Y, then XY (male). So the presence of the Y chromosome determines male sex. 

Looking at the options now. Option D says a single Y chromosome from the father. That seems correct because the father's sperm determines whether the child gets an X or Y. The Y comes from the father. So the Y chromosome from the father would make the child male. 

Option C says a Y from the mother, but mothers don't have Y chromosomes. They have two Xs, so they can't pass on a Y. So C is wrong. 

Option B is a recessive allele on the X. That might be referring to X-linked recessive disorders, like color blindness or hemophilia. But the question is about sex determination, not specific traits. So B is probably not the answer. 

Option A is the number of X chromosomes from the mother. But the mother always gives one X. The father gives either X or Y. So the number from the mother is always one. So A doesn't make sense. 

So the correct answer should be D. The Y chromosome from the father determines the male sex. If there's a Y, the child is male; otherwise, female. Yeah, that makes sense. I think that's right.
</think>

The sex of a child is determined by the inheritance of a Y chromosome from the father. Mothers contribute an X chromosome, while fathers contribute either an X (resulting in a female, XX) or a Y (resulting in a male, XY). Since mothers cannot pass a Y chromosome, the father's contribution dictates the sex. 

**[D]**",Correct
index_107,mmlu_clinical_knowledge,Which of the following is true in spastic paraplegia?,A,deepseek-ai/deepseek-r1,A,"<think>
Okay, let's tackle this question about spastic paraplegia. Hmm, I need to figure out which of the options A to D is true. Let me start by recalling what spastic paraplegia is.

Spastic paraplegia refers to a condition where there's weakness and spasticity (increased muscle tone) in the lower limbs. It's a type of upper motor neuron disorder, right? So upper motor neuron lesions typically cause spasticity, hyperreflexia, and maybe a positive Babinski sign. Lower motor neuron issues lead to flaccid paralysis and decreased reflexes. So that might help eliminate some options.

Looking at the options:

A. Multiple Sclerosis can cause this neurological pattern. MS is known to cause various neurological issues due to demyelination. Since MS can affect the spinal cord, leading to upper motor neuron signs, spastic paraparesis (which is similar to paraplegia) is a possible presentation. So A could be correct.

B. Proprioceptive loss is a common feature. Proprioception issues usually arise from problems in the dorsal columns of the spinal cord. If the lesion is in the corticospinal tracts (upper motor neurons), maybe proprioception isn't directly affected. But if there's a combined lesion, like in multiple sclerosis affecting both motor and sensory tracts, then maybe. But is proprioceptive loss a ""common feature"" of spastic paraplegia itself? I'm not sure. Maybe in some cases, but maybe not a defining feature. Need to think more.

C. Coordination in the legs is affected. Coordination problems like ataxia are usually cerebellar issues. Upper motor neuron lesions cause spasticity and weakness, but not necessarily ataxia. Unless there's also cerebellar involvement. But spastic paraplegia primarily affects the motor tracts. So maybe coordination isn't the main issue here. Unless the question is considering that spasticity affects coordination indirectly. Hmm.

D. The tone is normal or flaccid. No, spasticity means increased tone. So D is incorrect. So D is false. So that's out.

So between A, B, C. Let's go back. Spastic paraplegia is upper motor neuron, so spasticity, hyperreflexia, possible clonus. Proprioceptive loss would be a sensory issue. If the dorsal columns are intact, then proprioception is preserved. But in some conditions that cause spastic paraplegia, like hereditary spastic paraplegia, there might be some sensory involvement, but I think it's more about pure motor in many cases. However, if the cause is MS, which can affect multiple areas, maybe there's sensory loss. But the question is about what's true in spastic paraplegia in general. So if the answer is about the features of spastic paraplegia itself, then B might not be a common feature. But if the question is about conditions that can cause spastic paraplegia, then A is correct.

The question states ""Which of the following is true in spastic paraplegia?"" So the options are about the characteristics of spastic paraplegia. So A is a possible cause. So the question is whether Multiple Sclerosis can cause spastic paraplegia. Yes, MS can lead to spinal cord lesions (like in the cervical or thoracic cord) which can present with spastic paraparesis/paraplegia. So A is correct.

Option B: proprioceptive loss. If the spastic paraplegia is due to a pure motor tract lesion (like hereditary spastic paraplegia), then proprioception would be normal. But if the lesion also affects the dorsal columns (as in MS), then there could be proprioceptive loss. But the question is about what is true in spastic paraplegia. So if the answer is that proprioceptive loss is a common feature, then B would be correct only if it's a common feature. But I think in spastic paraplegia, the main issue is motor, so B might not be correct. Unless the condition causing it also affects sensory pathways. But the question is about the features of spastic paraplegia itself, not the underlying cause. Wait, no. The options are about what is true in spastic paraplegia. So if the paraplegia is due to a lesion that also affects sensory tracts, then B could be true. But if the question is about the features of spastic paraplegia regardless of cause, then maybe not. But the options are separate. So A is a possible cause (MS can cause it), which is a true statement. B is a feature of the condition. So the answer could be A and B. But the options are single choice.

Wait, the options are A to D, and the question is which is true. So if A is correct (MS can cause this), then A is a correct answer. B says proprioceptive loss is a common feature. If spastic paraplegia is due to a pure upper motor neuron lesion, then proprioception is preserved. So B would not be a common feature. But if the underlying cause (like MS) affects both motor and sensory tracts, then B could be present. But the question is about spastic paraplegia in general. So I think B is not a common feature. So A is correct.

C. Coordination in the legs is affected. Coordination issues (ataxia) are more cerebellar or sensory (sensory ataxia). Spasticity can lead to stiffness and difficulty moving, but that's not the same as ataxia. So C is probably incorrect.

So the correct answers would be A. Multiple Sclerosis can cause this neurological pattern. So the answer is A.
</think>

[A] 

**Step-by-Step Explanation:**

1. **Understanding Spastic Paraplegia:**  
   Spastic paraplegia is characterized by spasticity (increased muscle tone) and weakness in the lower limbs due to upper motor neuron (UMN) lesions. UMN lesions typically present with hyperreflexia, clonus, and Babinski signs.

2. **Analyzing Options:**  
   - **A. Multiple Sclerosis (MS) can cause this neurological pattern:**  
     MS causes demyelination in the central nervous system, including the spinal cord. Spinal cord lesions in MS often lead to spastic paraparesis/paraplegia, making this a valid cause. **True.**  
   - **B. Proprioceptive loss is a common feature:**  
     Proprioceptive loss arises from dorsal column (sensory pathway) damage. Spastic paraplegia primarily affects motor tracts (corticospinal). While some conditions (e.g., MS) may involve sensory tracts, proprioceptive loss is not a defining or common feature of spastic paraplegia itself. **False.**  
   - **C. Coordination in the legs is affected:**  
     Coordination issues (ataxia) are cerebellar or sensory in origin. Spastic paraplegia causes stiffness and weakness, not true ataxia. **False.**  
   - **D. The tone is normal or flaccid:**  
     Spasticity implies increased tone, so this contradicts the definition of spastic paraplegia. **False.**  

3. **Conclusion:**  
   The only correct statement is **A**, as MS is a recognized cause of spastic paraplegia. Proprioceptive loss (B) and coordination deficits (C) are not core features, and tone is spastic, not normal/flaccid (D).  

**Answer:** [A]",Correct
