id,dataset,question,ground_truth_answer,nvidia_model,nvidia_parsed_answer,nvidia_raw_response,nvidia_outcome
index_180,mmlu_clinical_knowledge,A change in blood pressure is detected by the:,A,deepseek-ai/deepseek-r1,A,"<think>
Okay, so I need to figure out which of the options A to D is responsible for detecting changes in blood pressure. Let me start by recalling what each of these terms refers to.

Baroreceptors: I remember that ""baro-"" relates to pressure, like barometer. So baroreceptors probably sense pressure changes. They are found in places like the carotid arteries and aorta. When blood pressure increases, they send signals to the brain to lower it, maybe by slowing the heart rate or dilating blood vessels.

Chemoreceptors: These detect chemical changes, like oxygen or carbon dioxide levels in the blood. For example, if oxygen levels drop, chemoreceptors in the carotid bodies and aortic arch would signal the brain to increase breathing rate. So they're more about chemical composition rather than pressure.

Vasomotor Centre: This is part of the brainstem, specifically the medulla. It controls the diameter of blood vessels. If blood pressure is low, the vasomotor center might cause vasoconstriction to increase pressure. But does it detect the change itself, or just respond to signals from receptors?

Cardiovascular Centre: This might be a broader term that includes both the vasomotor center and cardiac centers. The cardiovascular center would integrate information and send out responses, like adjusting heart rate and vessel diameter. But again, does it detect the change or just process the information received from receptors?

Putting this together: The question is about detection. The detectors are the receptors. So between A and B. Since the question is about blood pressure, which is a pressure change, baroreceptors (A) are the ones that detect that. Chemoreceptors (B) would be for chemical changes. The vasomotor and cardiovascular centers (C and D) are parts of the brain that respond to the information sent by the receptors, but they don't detect the initial change themselves.

So the answer should be A. Baroreceptors.
</think>

The correct answer is A. baroreceptors. Baroreceptors are specialized sensors located in the carotid arteries and aortic arch that detect changes in blood pressure. When blood pressure fluctuates, they send signals to the brain to initiate regulatory responses. Chemoreceptors (B) detect chemical changes, while the vasomotor (C) and cardiovascular (D) centers are brain regions that process signals and coordinate responses but do not directly detect pressure changes. 

[A]",Correct
index_181,mmlu_clinical_knowledge,Blood clots are responsible for repeatedly blocking a catheter. What should you do?,B,deepseek-ai/deepseek-r1,B,"<think>
Okay, let's tackle this question about blood clots blocking a catheter. So the question is asking what the appropriate action is when blood clots are repeatedly blocking a catheter. The options are A to D.

First, I need to recall standard procedures for dealing with catheter blockages. Blood clots can form in catheters, especially if the flow is slow or if there's some stasis. Repeated blockages might indicate an underlying issue. 

Option A: Call for help. That's a general first step in emergencies, but is this an emergency? If the catheter is blocked, maybe, but if it's happening repeatedly, maybe there's a protocol to follow. But I'm not sure if calling for help is the immediate action here. Maybe if the patient is in distress, but the question doesn't mention that.

Option B: Inform medical staff. This seems plausible. If a nurse or a healthcare provider notices the problem, informing the medical team (like a doctor) would be part of the process. They might decide to flush the catheter, use anticoagulants, or other interventions. But is informing them the first step, or should the responder take action first?

Option C: Inform the patient. Probably not the first action. The patient needs to be informed, but the priority is addressing the medical issue. So this might come later but isn't the immediate step.

Option D: Remove the catheter and recatheterize. That's a more invasive step. If clots are forming repeatedly, maybe the catheter is faulty or in a bad position. But removing it might be necessary if other measures fail. However, standard protocol might first involve trying to clear the clot (like with a heparin flush) before jumping to removal. So maybe D is too drastic unless there's no other option.

Putting this together: If clots are blocking the catheter repeatedly, the first step might be to inform the medical staff (B) so they can assess and decide on the next steps, like flushing or removing. However, if the blockage is causing immediate issues (like inability to administer meds), maybe removing is necessary. But the question says ""repeatedly,"" which suggests it's an ongoing issue. So the correct answer might be B. Alternatively, if the protocol is to remove after repeated blockages, then D. But I think usually, you would inform the medical staff first. Let me check guidelines. For example, in IV catheters, if there's a clot, you might try to aspirate or flush with saline, but if it's not working, then removal and reinsertion might be needed. However, the question states ""repeatedly,"" so maybe the catheter is not functioning properly and needs to be replaced. But the answer options don't mention attempting to flush. So between B and D. If the person is a nurse, they might inform the doctor (B), but if they have the authority, they might proceed to D. But in many settings, a nurse would need an order to remove and replace a catheter. So the correct answer would be B: Inform medical staff. Then the staff would decide to remove or take other actions. So the answer is B.
</think>

The appropriate action when blood clots repeatedly block a catheter is to inform medical staff, as they can assess the situation, determine the cause, and decide on interventions such as flushing, anticoagulant use, or catheter replacement. While removing the catheter (D) may eventually be necessary, this typically requires authorization from a healthcare provider. Informing the patient (C) is not the priority, and calling for help (A) is more suited to emergencies. The correct answer is **B**.

[B]",Correct
index_182,mmlu_clinical_knowledge,What is the pH of water?,B,deepseek-ai/deepseek-r1,B,"<think>
Okay, so the question is asking for the pH of water. Let me think. I remember that pH is a measure of how acidic or basic a solution is. The scale goes from 0 to 14. If something is acidic, it's below 7, and if it's basic, it's above 7. Neutral is right at 7.

Now, water is supposed to be neutral, right? Because pure water should have an equal concentration of hydrogen ions (H+) and hydroxide ions (OH-). When those concentrations are equal, the solution is neutral. So the pH should be 7. But wait, sometimes I hear that rainwater is slightly acidic, but that's because it dissolves carbon dioxide from the air, forming carbonic acid. But the question is just about water, not rainwater. So pure water, like distilled water, at standard temperature (25°C) should have a pH of 7. 

Looking at the options, option B is 7. The other options are 3.5, which is very acidic, 12 which is very basic, and 6.25 which is slightly acidic. But pure water shouldn't be acidic or basic. So the answer must be B. Unless there's a trick here. Wait, sometimes temperature affects pH. If the water is at a different temperature, the pH might change slightly because the ionization of water is temperature-dependent. But the question doesn't specify temperature, so I think the standard answer is 7. Yeah, I'm pretty sure B is correct.
</think>

The pH of pure water at standard temperature (25°C) is 7, as it is neutral with equal concentrations of H⁺ and OH⁻ ions. 

[B]",Correct
index_183,mmlu_clinical_knowledge,How long can a cannula remain in situ?,D,deepseek-ai/deepseek-r1,D,"<think>
Okay, so the question is asking how long a cannula can remain in situ. The options are 24, 36, 48, or 96 hours. Let me think about this.

First, I remember that cannulas are those small tubes inserted into a vein, usually for giving medications or fluids. The duration they can stay in might depend on various factors like the type of cannula, the patient's condition, and the risk of infection. 

I think there's a standard guideline here. From what I've studied before, hospitals often have protocols about changing cannulas to prevent infections. I recall something about 72-96 hours being a possible timeframe, but maybe that's for specific cases. Wait, but the options here don't include 72. The closest higher option is 96 hours (D), and the next lower is 48 (C). 

Wait, maybe I'm mixing up peripheral vs central lines. Peripheral intravenous cannulas (the ones in the arm) usually have shorter durations. I think the general recommendation is to replace them every 72-96 hours to reduce the risk of phlebitis or infection. But some studies suggest that replacing them only when clinically indicated (like signs of complications) might be just as safe. However, standard practice in many places is still every 3-4 days, which would be 72-96 hours. But the options here don't have 72. So D is 96 hours. But I'm not sure if that's the correct answer here. 

Alternatively, maybe some guidelines recommend changing them every 48 hours. Wait, I'm a bit confused. Let me check my notes. Oh right, the Centers for Disease Control and Prevention (CDC) guidelines say that peripheral intravenous catheters in adults should be replaced no more frequently than every 72-96 hours, but in the absence of complications, some sources say they can stay longer if necessary. However, in some clinical settings, especially in the UK, the recommendation might be 72 hours. But again, the options here don't have 72. So between 48 and 96. 

Wait, maybe the answer is 72 hours, but since that's not an option, perhaps the closest is 96. But I'm not certain. Alternatively, some sources might say 48 hours. Let me think again. For example, in some hospitals, the policy is to change cannulas every 72 hours. But if the options are 24, 36, 48, 96, then 96 would be the maximum. However, I've also heard that in pediatrics, they might leave them longer if there's no issue. 

Alternatively, maybe the correct answer is 72 hours, but since that's not listed, perhaps the intended answer is 48 hours. Wait, but I need to recall specific guidelines. The CDC's 2011 guidelines state that the cannula should be replaced every 72-96 hours. So if 96 is an option, that would be D. But some hospitals might have different policies. 

Alternatively, maybe the question is referring to UK guidelines. The UK's NICE guidelines might have different recommendations. Let me recall. NICE guidelines (maybe CG139) suggest that peripheral IV catheters should be clinically reviewed every 24 hours and removed if not needed. But the replacement interval isn't strictly defined, but many hospitals in the UK use 72-96 hours. 

Hmm. So given the options, the maximum time would be 96 hours (D). But I'm not 100% sure. Alternatively, some sources might say 72 hours, but since that's not an option, D is the closest. However, I've also heard that in some cases, if there's no signs of infection or phlebitis, they can stay longer. But the standard answer for exams might be 72-96 hours. So the answer here would be D. 

Wait, but another thought: some guidelines might recommend changing after 72 hours (3 days), which is 72, but since that's not an option, maybe 48 hours is the next best. Wait, no. If the options are 24, 36, 48, 96, then 96 is 4 days. If the guideline says up to 96, then D is correct. But if the guideline says 72, which is 3 days, but that's not an option, then maybe the answer intended here is 48 hours. But I'm not sure. 

Alternatively, maybe the correct answer is 72 hours, but since that's not listed, the next best is 48. But I need to check. Let me think of some textbooks. For example, according to the Infusion Nurses Society standards, peripheral IV catheters in adults can be left in situ for up to 72-96 hours. So if 96 is an option, that's D. Therefore, the answer should be D. 96 hours.
</think>

The recommended duration for a peripheral intravenous cannula to remain in situ, according to guidelines such as those from the CDC and Infusion Nurses Society, is typically up to 72-96 hours in the absence of complications. Among the provided options, 96 hours (D) aligns with the upper limit of this range. 

[D]",Correct
index_184,mmlu_clinical_knowledge,Metabolism is determined by the:,C,deepseek-ai/deepseek-r1,C,"<think>
Okay, let's tackle this question. The question is asking what determines metabolism. The options are A to D.

First, I need to recall what metabolism involves. Metabolism refers to all the chemical reactions in the body that maintain life. These reactions are catalyzed by enzymes, which are proteins. So enzymes are crucial for metabolic processes.

Now, looking at the options. Option A says the size of proteins. I don't think the size of proteins directly determines metabolism. It's more about the types of enzymes present rather than their size. So maybe A isn't the right answer.

Option B is availability of amino acids. While amino acids are needed to make proteins (enzymes), the question is about what determines metabolism. Availability affects it, but isn't the primary determinant. The presence of enzymes is more direct. So B might not be the main answer here.

Option C states proteins formed as dictated by genetic material. Since enzymes are proteins, and their production is directed by genes (DNA), this makes sense. The genetic material (DNA) contains the instructions for which proteins, including enzymes, are made. Different enzymes catalyze different reactions, thus determining the metabolic processes. So C seems correct.

Option D talks about amino acid composition of RNA. Wait, ribonucleic acids (RNA) like mRNA help in protein synthesis, but the amino acid composition of RNA itself doesn't make sense. RNA is made of nucleotides, not amino acids. So D is incorrect.

Putting it all together, the answer should be C. The genetic material dictates which proteins (enzymes) are made, and these enzymes determine the metabolic pathways.
</think>

The correct answer is C. Metabolism is driven by enzymes, which are proteins. The production of these proteins is directed by an organism's genetic material (DNA), which contains the instructions for synthesizing specific enzymes. These enzymes catalyze the chemical reactions that constitute metabolism. While amino acid availability (B) influences protein synthesis, the primary determinant is the genetic code that dictates which proteins are formed. Options A and D are irrelevant, as protein size (A) and RNA's amino acid composition (D) do not directly determine metabolic processes. 

[C]",Correct
index_185,mmlu_clinical_knowledge,How many chromosomes do all human somatic cells contain?,D,deepseek-ai/deepseek-r1,D,"<think>
Okay, so the question is asking how many chromosomes are in all human somatic cells. Let me think. Somatic cells are the regular body cells, right? Not the sex cells like sperm or eggs.

I remember that humans have a diploid number of chromosomes. Diploid means two sets. Each set comes from each parent. So if the gametes (sperm and egg) are haploid, which is half the number, then when they combine during fertilization, they form a diploid zygote.

Wait, the haploid number for humans is 23. Because each parent contributes 23 chromosomes. So when they combine, the total would be 46. So the somatic cells, which are diploid, should have 46 chromosomes. Let me check the options. Option D is 46. That makes sense. The other options: 23 is the haploid number, so that's for gametes. 3 and 20 are way too low. So the answer must be D.
</think>

The correct answer is D. 46. Human somatic cells are diploid, containing 23 pairs of chromosomes (one from each parent), totaling 46. Gametes (sperm/egg) are haploid (23 chromosomes), but somatic cells (body cells) have the full diploid set. 

[D]",Correct
index_186,mmlu_clinical_knowledge,Under what circumstances would you use antibiotics prior to catheterization?,C,deepseek-ai/deepseek-r1,C,"<think>
Okay, so I need to figure out under what circumstances antibiotics would be used before catheterization. Let's start by recalling what I know about catheterization and antibiotic prophylaxis.

Catheterization, like inserting a urinary catheter, can introduce bacteria into the urinary tract, leading to infections. But when do you give antibiotics beforehand? I remember that antibiotics are sometimes given prophylactically to prevent infections in certain high-risk patients.

Looking at the options:

Option A: If the patient has had a catheter in situ for a week. Hmm, if the catheter's already been there, maybe they already have a higher risk of infection. But the question is about prior to catheterization. So maybe this is a scenario where they're replacing a catheter that's been in for a week. But I'm not sure if that's a reason to give antibiotics before inserting a new one. I think prolonged catheter use increases infection risk, but does that mean you give antibiotics when replacing it? Not sure. Maybe not the answer here.

Option B: If the patient does not have a urinary tract infection. Wait, if they don't have an infection, why give antibiotics? Prophylaxis is for preventing infection, so maybe this is a trick question. But usually, you don't give antibiotics unless there's a specific indication. So maybe B is not correct. Unless the absence of UTI is a reason to give prophylaxis, which doesn't make sense. Probably not B.

Option C: If the patient has an artificial heart valve. Oh, right! Patients with certain cardiac conditions, like prosthetic heart valves, are at risk for infective endocarditis. Procedures that might cause bacteremia (like urinary catheterization, though it's less common) might require antibiotic prophylaxis. The American Heart Association guidelines recommend prophylaxis for certain dental procedures, but for genitourinary procedures, it's more specific. Wait, I think for urinary tract procedures in patients with high-risk cardiac conditions, antibiotics are recommended. So if someone has an artificial heart valve, which is a high-risk factor, they might get antibiotics before catheterization to prevent endocarditis. That makes sense. So C could be the answer.

Option D: If the patient requests them. No, antibiotics aren't given just because a patient asks. There needs to be a medical indication. So D is not correct.

So putting it together: The correct answer is C. Patients with artificial heart valves (or other conditions that predispose to endocarditis) would receive prophylactic antibiotics before certain procedures, including catheterization if there's a risk of introducing bacteria into the bloodstream.
</think>

The use of antibiotics prior to catheterization is indicated in patients at high risk of complications from bacteremia, such as those with artificial heart valves. This aligns with guidelines for preventing infective endocarditis in high-risk individuals during procedures that may introduce bacteria into the bloodstream. Other options either describe scenarios where antibiotics are unnecessary (B, D) or relate to existing catheter management (A), which does not typically warrant prophylaxis. 

[C]",Correct
index_187,mmlu_clinical_knowledge,Which of these features suggest that a pulsation in the neck is arterial?,C,deepseek-ai/deepseek-r1,C,"<think>
Okay, let's tackle this question. The question is asking which feature suggests that a pulsation in the neck is arterial. The options are A to D.

First, I need to recall what differentiates arterial from venous pulsations. Arterial pulsations are usually more brisk and synchronous with the heartbeat. Venous pulsations, like in the jugular vein, are more undulating and can vary with posture or pressure.

Looking at the options:

Option A: A waggling earlobe. Hmm, not sure. Maybe related to something else, like a carotid artery issue causing movement elsewhere? Not sure. I don't remember earlobe movement being a direct sign of arterial pulsation.

Option B: Positive for hepatojugular reflux. Hepatojugular reflux is when pressing on the liver increases jugular venous pressure. That's a venous sign. So if positive, it would suggest venous rather than arterial. So B is probably not the answer.

Option C: No variation with posture. Venous pulsations usually change with posture. For example, when lying down, jugular veins might be more distended. If the pulsation doesn't vary with posture, that's more likely arterial. So C could be correct.

Option D: Pressure in the root of the neck reduces the impulse. The root of the neck is where the subclavian and jugular veins are. If pressing there reduces the impulse, maybe it's compressing a vein. Venous pulsations can be stopped by pressure, whereas arterial (like carotid) pulsations are harder to stop with light pressure. So if pressing reduces it, that's venous. So D would not be the answer. Wait, but if you press on the artery, like the carotid, you can stop the pulsation. But the root of the neck might be more about the veins. Hmm, need to think. The jugular vein runs more superficially, so pressure there might affect venous pulsation. Arterial pulsations (carotid) are deeper. So if pressing the root of the neck (maybe over the supraclavicular area) reduces the impulse, that's more likely venous. So D would indicate venous, so the correct answer would be the opposite. So if the pulsation is arterial, pressing there wouldn't reduce it as much. So D is a feature of venous, so the correct answer is not D.

So putting it together: the correct answer is C. Because arterial pulsations don't vary with posture, whereas venous ones do. Also, hepatojugular reflux (B) is venous. Waggling earlobe (A) I'm not sure, but maybe that's a trick option. So the answer is C.
</think>

The correct answer is C. Arterial pulsations, such as those from the carotid artery, typically do not vary with posture, whereas venous pulsations (e.g., jugular) often change with positioning. Hepatojugular reflux (B) and pressure reducing the impulse (D) are associated with venous pulsations. A waggling earlobe (A) is unrelated. 

[C]",Correct
index_188,mmlu_clinical_knowledge,The rate limiting enzyme of glycolysis is:,D,deepseek-ai/deepseek-r1,D,"<think>
Okay, so I need to figure out which enzyme is the rate-limiting step in glycolysis. Let me start by recalling what glycolysis is. Glycolysis is the metabolic pathway that converts glucose into pyruvate, producing ATP along the way. The rate-limiting enzyme would be the one that controls the speed of the entire pathway, right?

I remember that rate-limiting enzymes are usually the ones that catalyze irreversible reactions, which are also often the points of regulation. Let's think about the key enzymes in glycolysis. The main ones I can remember are hexokinase, phosphofructokinase (PFK), and pyruvate kinase. These are the three regulatory enzymes. 

Phosphorylase, option A, that's involved in glycogen breakdown, not glycolysis directly. So maybe A isn't the right answer. Hexokinase (B) catalyzes the first step, adding a phosphate to glucose to make glucose-6-phosphate. But I think that while hexokinase is regulated, maybe the main control point is later. 

Phosphofructokinase (D) is PFK-1, which catalyzes the conversion of fructose-6-phosphate to fructose-1,6-bisphosphate. I remember that this step is a major regulatory point. PFK-1 is allosterically activated by things like AMP and ADP when energy is low, and inhibited by ATP and citrate when there's plenty of energy. Since this step commits the glucose to glycolysis (as opposed to other pathways like the pentose phosphate pathway), it makes sense that this is the rate-limiting step. 

Pyruvate dehydrogenase (C) is part of the link reaction between glycolysis and the citric acid cycle, converting pyruvate to acetyl-CoA. That's not part of glycolysis itself, so C is probably not the answer. 

So between B and D. Hexokinase is regulated, but maybe the main rate-limiting step is PFK. Let me check my notes. Oh right, the rate-limiting enzyme is the one that determines the overall rate of the pathway. In glycolysis, phosphofructokinase-1 is considered the most important regulatory enzyme. So the answer should be D. Phosphofructokinase.
</think>

The rate-limiting enzyme in glycolysis is phosphofructokinase (PFK-1), which catalyzes the conversion of fructose-6-phosphate to fructose-1,6-bisphosphate. This step is a key regulatory point due to its allosteric control by energy status (e.g., activation by AMP/ADP and inhibition by ATP/citrate). Other options like hexokinase (B) are regulated but not the primary rate-determining step, while phosphorylase (A) and pyruvate dehydrogenase (C) are not part of glycolysis. 

[D]",Correct
